Date,Title,Description,Link
"Tue, 09 Jun 2015 09:32:57 +0000","Meanwhile in India, Vodafone and Airtel inject javascript and IFRAMES into all http websites","<table> <tr><td> <a href=""http://www.reddit.com/r/netneutrality/comments/3955kp/meanwhile_in_india_vodafone_and_airtel_inject/""><img src=""http://a.thumbs.redditmedia.com/GK-nc2KlMHmwMjz7KVexNhFvtmR8TUEOBXW__dc8Tu0.jpg"" alt=""Meanwhile in India, Vodafone and Airtel inject javascript and IFRAMES into all http websites"" title=""Meanwhile in India, Vodafone and Airtel inject javascript and IFRAMES into all http websites"" /></a> </td><td> submitted by <a href=""http://www.reddit.com/user/CyberianCitizen""> CyberianCitizen </a> <br/> <a href=""http://johndasfundas.blogspot.com/2015/06/are-airtel-and-vodafone-india-3g.html"">[link]</a> <a href=""http://www.reddit.com/r/netneutrality/comments/3955kp/meanwhile_in_india_vodafone_and_airtel_inject/"">[comment]</a> </td></tr></table>",http://www.reddit.com/r/netneutrality/comments/3955kp/meanwhile_in_india_vodafone_and_airtel_inject/
"Sat, 06 Jun 2015 07:37:32 -0700",Save The Internet What Will Happen If Net Neutrality Fails In India,"submitted by <a href=""http://www.reddit.com/user/NayanMeckwan""> NayanMeckwan </a> <br/> <a href=""https://www.youtube.com/attribution_link?a=JCoWMg1AqZA&amp;u=%2Fwatch%3Fv%3DMy-mjXSocHs%26feature%3Dshare"">[link]</a> <a href=""http://www.reddit.com/r/netneutrality/comments/38ssdn/save_the_internet_what_will_happen_if_net/"">[comment]</a>",http://www.reddit.com/r/netneutrality/comments/38ssdn/save_the_internet_what_will_happen_if_net/
"Tue, 02 Jun 2015 12:06:15 -0700",TIL that after NetFlix's S3 House of Cards was released the bandwidth required to run Netflix went from 30% to 45% of the total Internet bandwidth in the US (TIL xpost),"<table> <tr><td> <a href=""http://www.reddit.com/r/netneutrality/comments/389b4o/til_that_after_netflixs_s3_house_of_cards_was/""><img src=""http://b.thumbs.redditmedia.com/oI1TR6eJIcRT-KJQBZA-I0gfXn4JUfqVY0kwVpWxcFE.jpg"" alt=""TIL that after NetFlix's S3 House of Cards was released the bandwidth required to run Netflix went from 30% to 45% of the total Internet bandwidth in the US (TIL xpost)"" title=""TIL that after NetFlix's S3 House of Cards was released the bandwidth required to run Netflix went from 30% to 45% of the total Internet bandwidth in the US (TIL xpost)"" /></a> </td><td> submitted by <a href=""http://www.reddit.com/user/BICEP2""> BICEP2 </a> <br/> <a href=""http://www.reddit.com/r/todayilearned/comments/387fdx/til_that_after_netflixs_s3_house_of_cards_was/"">[link]</a> <a href=""http://www.reddit.com/r/netneutrality/comments/389b4o/til_that_after_netflixs_s3_house_of_cards_was/"">[comment]</a> </td></tr></table>",http://www.reddit.com/r/netneutrality/comments/389b4o/til_that_after_netflixs_s3_house_of_cards_was/
"Fri, 22 May 2015 06:01:05 -0700",Former FCC wireless chief: FCC's Open Internet Order Won't Stand Up To The First Amendment,"<!-- SC_OFF --><div class=""md""><p>So it looks like the next attack is shaping up, and they are going to use the 1st Amendment?? <a href=""http://www.forbes.com/sites/realspin/2015/05/21/fccs-open-internet-order-wont-stand-up-to-the-first-amendment/"">http://www.forbes.com/sites/realspin/2015/05/21/fccs-open-internet-order-wont-stand-up-to-the-first-amendment/</a></p> </div><!-- SC_ON --> submitted by <a href=""http://www.reddit.com/user/Mpls_Is_Rivendell""> Mpls_Is_Rivendell </a> <br/> <a href=""http://www.reddit.com/r/netneutrality/comments/36vfnt/former_fcc_wireless_chief_fccs_open_internet/"">[link]</a> <a href=""http://www.reddit.com/r/netneutrality/comments/36vfnt/former_fcc_wireless_chief_fccs_open_internet/"">[2 comments]</a>",http://www.reddit.com/r/netneutrality/comments/36vfnt/former_fcc_wireless_chief_fccs_open_internet/
"Thu, 21 May 2015 10:06:35 -0700",What is the stand of twitter regarding Net Neutrality?,"<!-- SC_OFF --><div class=""md""><p>Ncell (Nepalese Telecom Company owned by TeliaSonera) has been providing free twitter service to its user for a while. Does&#39;t this violate Net neutrality?</p> </div><!-- SC_ON --> submitted by <a href=""http://www.reddit.com/user/__0_""> __0_ </a> <br/> <a href=""http://www.reddit.com/r/netneutrality/comments/36rw8z/what_is_the_stand_of_twitter_regarding_net/"">[link]</a> <a href=""http://www.reddit.com/r/netneutrality/comments/36rw8z/what_is_the_stand_of_twitter_regarding_net/"">[1 comment]</a>",http://www.reddit.com/r/netneutrality/comments/36rw8z/what_is_the_stand_of_twitter_regarding_net/
"Wed, 20 May 2015 19:03:31 -0700",New Net Neutrality Song!,"<!-- SC_OFF --><div class=""md""><p>Hey guys! I made a song dedicated to listing my grievances to the FCC. <a href=""https://soundcloud.com/austin-zhang-6/netneutrality"">https://soundcloud.com/austin-zhang-6/netneutrality</a></p> <p>Help me keep the net neutral and head over to this facebook page: <a href=""https://www.facebook.com/thatnetneutralityfire"">https://www.facebook.com/thatnetneutralityfire</a> and throw me a like! Thank You</p> </div><!-- SC_ON --> submitted by <a href=""http://www.reddit.com/user/NetNeutralFire""> NetNeutralFire </a> <br/> <a href=""http://www.reddit.com/r/netneutrality/comments/36pfuk/new_net_neutrality_song/"">[link]</a> <a href=""http://www.reddit.com/r/netneutrality/comments/36pfuk/new_net_neutrality_song/"">[1 comment]</a>",http://www.reddit.com/r/netneutrality/comments/36pfuk/new_net_neutrality_song/
"Wed, 20 May 2015 07:39:54 -0700","Internet.org Is Not Neutral, Not Secure, and Not the Internet","<table> <tr><td> <a href=""http://www.reddit.com/r/netneutrality/comments/36mobg/internetorg_is_not_neutral_not_secure_and_not_the/""><img src=""http://a.thumbs.redditmedia.com/l8T9uXusJQyxA6KcxxRebpqAmoMTHcZG-bW4RvM7X78.jpg"" alt=""Internet.org Is Not Neutral, Not Secure, and Not the Internet"" title=""Internet.org Is Not Neutral, Not Secure, and Not the Internet"" /></a> </td><td> submitted by <a href=""http://www.reddit.com/user/iL0geeK""> iL0geeK </a> <br/> <a href=""https://www.eff.org/deeplinks/2015/05/internetorg-not-neutral-not-secure-and-not-internet"">[link]</a> <a href=""http://www.reddit.com/r/netneutrality/comments/36mobg/internetorg_is_not_neutral_not_secure_and_not_the/"">[2 comments]</a> </td></tr></table>",http://www.reddit.com/r/netneutrality/comments/36mobg/internetorg_is_not_neutral_not_secure_and_not_the/
"Wed, 20 May 2015 00:09:00 -0700",I need help understanding the good points of Net Neutraliy,"<!-- SC_OFF --><div class=""md""><p>Recently, someone sent me this in a discussion we were having on Net Neutrality. From what I know about net neutrality, alot of this doesn&#39;t seem to make sense. But I don&#39;t know enough to understand what is wrong with it. Can someone help?</p> <blockquote> <p>&quot;I understand that internet providers aren&#39;t doing anything that&#39;s &quot;not neutral.&quot; Which is my fucking point. And I&#39;m aware that the FCC went out of their lane and reclassified the internet(though no net neutrality bill has been passed which limits what they can do. No point to it though, not more than one instance where the big bad companies were doing something mean to you, and yet lot&#39;s of potential downfalls.</p> <p>So no proven downside WHATSOEVER to not having the law/reclassification. Hypothetical bullshit. Makes me wonder why people want the law then....</p> <p>Ajit Pai(a dissenting FCC commissioner) said it best, &quot;net neutrality is a solution that won&#39;t work to a problem that simply doesn&#39;t exist.&quot;</p> <p>So what DOES deeming the internet regulable under Title 2 mean? It means that the internet is no longer an information service and becomes a &quot;telecommunications service&quot; that can be regulated by the FCC...like basic fucking cable.</p> <p>The utter bullshit about ISP&#39;s holding people hostage was and is complete and total fear mongering that never had any basis in fact and was simply one of Bob McChesney&#39;s many mantras that never came true. At this point he&#39;s been wrong 100% of the time about all the evil things that were going to happen if the internet wasn&#39;t regulated and yet the left still holds on to his every word.</p> <p>If an actual law passes which would accomplish far more than a regulation change, expect slower broadband, more expensive broadband, fewer options for service, and generally less innovation.</p> <p>Side note: the government does almost nothing well. Why people would want to let them enter an arena that works wonderfully and has changed everyone&#39;s life for the better...is completely beyond me. For that matter, I&#39;m not convinced the FCC should exist at all. There are no longer 3 networks. There are hundreds. Thousands and thousands of internet &quot;networks&quot; and millions of opportunities for entertainment and news. Satellite radio. It goes on and on...no point to it at all except perhaps to regulate VHF frequencies and UHF frequencies that shouldn&#39;t be clogged with trash.&quot;</p> </blockquote> </div><!-- SC_ON --> submitted by <a href=""http://www.reddit.com/user/Catlover18""> Catlover18 </a> <br/> <a href=""http://www.reddit.com/r/netneutrality/comments/36lhtk/i_need_help_understanding_the_good_points_of_net/"">[link]</a> <a href=""http://www.reddit.com/r/netneutrality/comments/36lhtk/i_need_help_understanding_the_good_points_of_net/"">[3 comments]</a>",http://www.reddit.com/r/netneutrality/comments/36lhtk/i_need_help_understanding_the_good_points_of_net/
"Sun, 17 May 2015 00:01:35 -0700",How do i fight this? ISP new policy with data caps on home internet.,"<!-- SC_OFF --><div class=""md""><p>Telus is a canadian isp and as of march 30th changed their internet plans to make your internet limited (to as little as 30GB for some customers). I have received warnings that i in previous months go over data caps that never existed. My household usage of internet i would call average. This is the statement on their website <a href=""http://www.telus.com/en/bc/get-help/account-and-billing/understand-your-bill/ffh/usage-based-internet-charges/support.do"">http://www.telus.com/en/bc/get-help/account-and-billing/understand-your-bill/ffh/usage-based-internet-charges/support.do</a> This is the canadian telecommunications act <a href=""http://laws-lois.justice.gc.ca/eng/acts/T-3.4/page-2.html#h-6"">http://laws-lois.justice.gc.ca/eng/acts/T-3.4/page-2.html#h-6</a></p> </div><!-- SC_ON --> submitted by <a href=""http://www.reddit.com/user/slappedbassist""> slappedbassist </a> <br/> <a href=""http://www.reddit.com/r/netneutrality/comments/368r3o/how_do_i_fight_this_isp_new_policy_with_data_caps/"">[link]</a> <a href=""http://www.reddit.com/r/netneutrality/comments/368r3o/how_do_i_fight_this_isp_new_policy_with_data_caps/"">[2 comments]</a>",http://www.reddit.com/r/netneutrality/comments/368r3o/how_do_i_fight_this_isp_new_policy_with_data_caps/
"Wed, 13 May 2015 23:08:45 -0700",Internet Politics from 1996: Bob Dole supported Net Neutrality,"<table> <tr><td> <a href=""http://www.reddit.com/r/netneutrality/comments/35x3hl/internet_politics_from_1996_bob_dole_supported/""><img src=""http://b.thumbs.redditmedia.com/Wc3xjeHozDbCqa1CM8oH2enT0YjOJ0IFUT2f2mFHseo.jpg"" alt=""Internet Politics from 1996: Bob Dole supported Net Neutrality"" title=""Internet Politics from 1996: Bob Dole supported Net Neutrality"" /></a> </td><td> submitted by <a href=""http://www.reddit.com/user/lordpoee""> lordpoee </a> <br/> <a href=""http://www.dolekemp96.org/agenda/issues/internet.htm"">[link]</a> <a href=""http://www.reddit.com/r/netneutrality/comments/35x3hl/internet_politics_from_1996_bob_dole_supported/"">[comment]</a> </td></tr></table>",http://www.reddit.com/r/netneutrality/comments/35x3hl/internet_politics_from_1996_bob_dole_supported/
"Wed, 13 May 2015 12:45:02 -0700",Internet.not,"<table> <tr><td> <a href=""http://www.reddit.com/r/netneutrality/comments/35v50o/internetnot/""><img src=""http://b.thumbs.redditmedia.com/6llEUbMslMBKiGP7uLhHwHgE1ze5ZKTz3KFBp33sFUQ.jpg"" alt=""Internet.not"" title=""Internet.not"" /></a> </td><td> submitted by <a href=""http://www.reddit.com/user/jdtabish""> jdtabish </a> <br/> <a href=""http://www.huffingtonpost.com/timothy-karr/internetnot_b_7272904.html"">[link]</a> <a href=""http://www.reddit.com/r/netneutrality/comments/35v50o/internetnot/"">[comment]</a> </td></tr></table>",http://www.reddit.com/r/netneutrality/comments/35v50o/internetnot/
"Sun, 10 May 2015 08:06:44 -0700",iFreedom- online freedom,"<table> <tr><td> <a href=""http://www.reddit.com/r/netneutrality/comments/35hvbq/ifreedom_online_freedom/""><img src=""http://b.thumbs.redditmedia.com/HVsDTXXa8Qwzs8w1zfnyfI9P3MWv7kILcgoHXgTpY4U.jpg"" alt=""iFreedom- online freedom"" title=""iFreedom- online freedom"" /></a> </td><td> submitted by <a href=""http://www.reddit.com/user/rajkotraja99""> rajkotraja99 </a> <br/> <a href=""http://www.ifreedomapp.com/app"">[link]</a> <a href=""http://www.reddit.com/r/netneutrality/comments/35hvbq/ifreedom_online_freedom/"">[comment]</a> </td></tr></table>",http://www.reddit.com/r/netneutrality/comments/35hvbq/ifreedom_online_freedom/
"Sat, 09 May 2015 16:32:58 -0700",Linus jabs at net neutrality,"<!-- SC_OFF --><div class=""md""><p><a href=""https://www.youtube.com/watch?v=n71TUnTNdw8"">https://www.youtube.com/watch?v=n71TUnTNdw8</a></p> </div><!-- SC_ON --> submitted by <a href=""http://www.reddit.com/user/CaDoran""> CaDoran </a> <br/> <a href=""http://www.reddit.com/r/netneutrality/comments/35fwqe/linus_jabs_at_net_neutrality/"">[link]</a> <a href=""http://www.reddit.com/r/netneutrality/comments/35fwqe/linus_jabs_at_net_neutrality/"">[1 comment]</a>",http://www.reddit.com/r/netneutrality/comments/35fwqe/linus_jabs_at_net_neutrality/
"Fri, 08 May 2015 08:34:40 -0700",Sound the alarm! Facebook and Big Telecom providers are pushing a new service that will block over 3 billion soon-to-be Internet users from the open Internet.,"<table> <tr><td> <a href=""http://www.reddit.com/r/netneutrality/comments/35at6d/sound_the_alarm_facebook_and_big_telecom/""><img src=""http://b.thumbs.redditmedia.com/_DwBH0AIlsqxDDKOnO8CSkepQy5uV6UcO2ZvapS0iHE.jpg"" alt=""Sound the alarm! Facebook and Big Telecom providers are pushing a new service that will block over 3 billion soon-to-be Internet users from the open Internet."" title=""Sound the alarm! Facebook and Big Telecom providers are pushing a new service that will block over 3 billion soon-to-be Internet users from the open Internet."" /></a> </td><td> submitted by <a href=""http://www.reddit.com/user/fermier""> fermier </a> <br/> <a href=""https://openmedia.org/fakeinternet"">[link]</a> <a href=""http://www.reddit.com/r/netneutrality/comments/35at6d/sound_the_alarm_facebook_and_big_telecom/"">[comment]</a> </td></tr></table>",http://www.reddit.com/r/netneutrality/comments/35at6d/sound_the_alarm_facebook_and_big_telecom/
"Wed, 06 May 2015 16:07:17 -0700",Voting in the UK - Which party?,"<!-- SC_OFF --><div class=""md""><p>So I&#39;ve had a general look around, and I simply want to vote for whichever party is the most positive in relation to net neutrality , but not really found much in relation to what each parties stances on it are.</p> <p>Could anyone give me a run down?</p> </div><!-- SC_ON --> submitted by <a href=""http://www.reddit.com/user/Tooooon""> Tooooon </a> <br/> <a href=""http://www.reddit.com/r/netneutrality/comments/3544id/voting_in_the_uk_which_party/"">[link]</a> <a href=""http://www.reddit.com/r/netneutrality/comments/3544id/voting_in_the_uk_which_party/"">[1 comment]</a>",http://www.reddit.com/r/netneutrality/comments/3544id/voting_in_the_uk_which_party/
"Mon, 04 May 2015 17:18:59 -0700",Now that you know net neutrality is the anthropogenic global warming/climate change strategy for the tech sector...what are you going to do now?,"<!-- SC_OFF --><div class=""md""><p>So it turns out like many had already suspected that cogent was the issue in the Netflix CDN bandwidth throttling debacle and not Comcast. So since net neutrality does not address anything past the last mile ISP, ie.... Internet transit service providers like cogent L3 Akamai etc. how is net neutrality going to help us now? </p> </div><!-- SC_ON --> submitted by <a href=""http://www.reddit.com/user/Imthemobileguru""> Imthemobileguru </a> <br/> <a href=""http://www.reddit.com/r/netneutrality/comments/34vx02/now_that_you_know_net_neutrality_is_the/"">[link]</a> <a href=""http://www.reddit.com/r/netneutrality/comments/34vx02/now_that_you_know_net_neutrality_is_the/"">[1 comment]</a>",http://www.reddit.com/r/netneutrality/comments/34vx02/now_that_you_know_net_neutrality_is_the/
"Mon, 04 May 2015 07:53:48 -0700",Facebook Opens Internet.Org To All Developers In Response To Net Neutrality Concerns,"<table> <tr><td> <a href=""http://www.reddit.com/r/netneutrality/comments/34tv5z/facebook_opens_internetorg_to_all_developers_in/""><img src=""http://b.thumbs.redditmedia.com/cXqlw3koiEKyVhQ1y3Kxeu3tHGaTlTlDOLMBIsBl0sk.jpg"" alt=""Facebook Opens Internet.Org To All Developers In Response To Net Neutrality Concerns"" title=""Facebook Opens Internet.Org To All Developers In Response To Net Neutrality Concerns"" /></a> </td><td> submitted by <a href=""http://www.reddit.com/user/Akhilan""> Akhilan </a> <br/> <a href=""http://techcrunch.com/2015/05/04/facebooks-internet-org-project-is-now-a-platform/"">[link]</a> <a href=""http://www.reddit.com/r/netneutrality/comments/34tv5z/facebook_opens_internetorg_to_all_developers_in/"">[1 comment]</a> </td></tr></table>",http://www.reddit.com/r/netneutrality/comments/34tv5z/facebook_opens_internetorg_to_all_developers_in/
"Tue, 28 Apr 2015 10:41:43 -0700",Net neutrality: Commission tries to break deadlock,"<table> <tr><td> <a href=""http://www.reddit.com/r/netneutrality/comments/346drs/net_neutrality_commission_tries_to_break_deadlock/""><img src=""http://b.thumbs.redditmedia.com/1ZTirROlNQLOX1wJrIYYeoWNcCLu1stMJC9apdi9Oow.jpg"" alt=""Net neutrality: Commission tries to break deadlock"" title=""Net neutrality: Commission tries to break deadlock"" /></a> </td><td> submitted by <a href=""http://www.reddit.com/user/euraffex""> euraffex </a> <br/> <a href=""http://www.politico.eu/article/net-neutrality-deadlock-commission-break/"">[link]</a> <a href=""http://www.reddit.com/r/netneutrality/comments/346drs/net_neutrality_commission_tries_to_break_deadlock/"">[comment]</a> </td></tr></table>",http://www.reddit.com/r/netneutrality/comments/346drs/net_neutrality_commission_tries_to_break_deadlock/
"Mon, 27 Apr 2015 12:11:58 -0700","TRAI-leaked netneutrality email ,Trai 'makes you pay' for supporting net neutrality","submitted by <a href=""http://www.reddit.com/user/youandtube""> youandtube </a> <br/> <a href=""http://www.reddit.com/r/netneutrality/comments/342a31/traileaked_netneutrality_email_trai_makes_you_pay/"">[link]</a> <a href=""http://www.reddit.com/r/netneutrality/comments/342a31/traileaked_netneutrality_email_trai_makes_you_pay/"">[2 comments]</a>",http://www.reddit.com/r/netneutrality/comments/342a31/traileaked_netneutrality_email_trai_makes_you_pay/
"Mon, 27 Apr 2015 08:21:04 -0700",Is my internet service provider slowing down my speed to certain websites?,"<!-- SC_OFF --><div class=""md""><p>I watch live cricket on free websites and when I watch it on my ISP, the video is choppy, pauses a lot and quality is poor. But today I got a VPN service, I&#39;m downloading a 10GB file at 1-2MB per sec and streaming live cricket. The live cricket video is high quality and not choppy at all. </p> <p>My guess is that because I&#39;m not paying ESPN to stream my live matches and watching them on free websites, Comcast probably has these sites marked to provide slow service. </p> <p>Is this right? What can i do?</p> </div><!-- SC_ON --> submitted by <a href=""http://www.reddit.com/user/Itsa24""> Itsa24 </a> <br/> <a href=""http://www.reddit.com/r/netneutrality/comments/341dru/is_my_internet_service_provider_slowing_down_my/"">[link]</a> <a href=""http://www.reddit.com/r/netneutrality/comments/341dru/is_my_internet_service_provider_slowing_down_my/"">[1 comment]</a>",http://www.reddit.com/r/netneutrality/comments/341dru/is_my_internet_service_provider_slowing_down_my/
"Sat, 25 Apr 2015 14:36:48 -0700",Could you help me out /r/NetNeutrality?,"<!-- SC_OFF --><div class=""md""><p>I&#39;m a college student. I&#39;m writing my final research paper on Net Neutrality and I&#39;m looking for a primary source for additional info on this topic. If anyone has any helpful links or such let me know please! I figured this wouldn&#39;t be a bad place to start asking. </p> </div><!-- SC_ON --> submitted by <a href=""http://www.reddit.com/user/KingKicker""> KingKicker </a> <br/> <a href=""http://www.reddit.com/r/netneutrality/comments/33uxjs/could_you_help_me_out_rnetneutrality/"">[link]</a> <a href=""http://www.reddit.com/r/netneutrality/comments/33uxjs/could_you_help_me_out_rnetneutrality/"">[6 comments]</a>",http://www.reddit.com/r/netneutrality/comments/33uxjs/could_you_help_me_out_rnetneutrality/
"Sat, 25 Apr 2015 11:28:04 -0700",Net Neutrality in India: Nixi Against Selective Bundling of Apps by Telcos,"<table> <tr><td> <a href=""http://www.reddit.com/r/netneutrality/comments/33ubvw/net_neutrality_in_india_nixi_against_selective/""><img src=""http://b.thumbs.redditmedia.com/s7W2wgLTLUWZxfYC6elvh-4oYBTheQO7VWHUg8K338U.jpg"" alt=""Net Neutrality in India: Nixi Against Selective Bundling of Apps by Telcos"" title=""Net Neutrality in India: Nixi Against Selective Bundling of Apps by Telcos"" /></a> </td><td> submitted by <a href=""http://www.reddit.com/user/jerkshakespear""> jerkshakespear </a> <br/> <a href=""http://www.thetechoholic.com/2015/04/net-neutrality-in-india-nixi-against.html"">[link]</a> <a href=""http://www.reddit.com/r/netneutrality/comments/33ubvw/net_neutrality_in_india_nixi_against_selective/"">[comment]</a> </td></tr></table>",http://www.reddit.com/r/netneutrality/comments/33ubvw/net_neutrality_in_india_nixi_against_selective/
"Thu, 23 Apr 2015 08:41:08 -0700",I have to present a case against Net Neutrality-- what are some cons of a free internet?,"<!-- SC_OFF --><div class=""md""><p>I&#39;m in a Mass Media Law class where, in a few weeks, I have to take part in a &quot;mock trial,&quot; and present a case against Net Neutrality. Problem is, my group and I feel strongly in favor of Net Neutrality and aren&#39;t finding many good resources to counter Net Neutrality. Can anyone give me an argument against a free and open internet?</p> </div><!-- SC_ON --> submitted by <a href=""http://www.reddit.com/user/bran_liggers""> bran_liggers </a> <br/> <a href=""http://www.reddit.com/r/netneutrality/comments/33lrvb/i_have_to_present_a_case_against_net_neutrality/"">[link]</a> <a href=""http://www.reddit.com/r/netneutrality/comments/33lrvb/i_have_to_present_a_case_against_net_neutrality/"">[9 comments]</a>",http://www.reddit.com/r/netneutrality/comments/33lrvb/i_have_to_present_a_case_against_net_neutrality/
"Sun, 19 Apr 2015 23:08:50 -0700",What were some of the places you first went when you got your driver's permit? Did those destinations change once you got a full driver's license? I'm working on an article comparing Zero-Rating and Internet.org to the bubble of the mall for highschoolers.,"submitted by <a href=""http://www.reddit.com/user/cocusmajorus""> cocusmajorus </a> <br/> <a href=""http://www.reddit.com/r/netneutrality/comments/337gb3/what_were_some_of_the_places_you_first_went_when/"">[link]</a> <a href=""http://www.reddit.com/r/netneutrality/comments/337gb3/what_were_some_of_the_places_you_first_went_when/"">[2 comments]</a>",http://www.reddit.com/r/netneutrality/comments/337gb3/what_were_some_of_the_places_you_first_went_when/
"Sun, 19 Apr 2015 20:33:41 -0700",Australian telcos want Netflix to pay for speed. Net neutrality begone!,"<table> <tr><td> <a href=""http://www.reddit.com/r/netneutrality/comments/3372fx/australian_telcos_want_netflix_to_pay_for_speed/""><img src=""http://a.thumbs.redditmedia.com/PKXmASbNJrxS7JSSxXm_qx5vEleuOFfsU09PYUXquF8.jpg"" alt=""Australian telcos want Netflix to pay for speed. Net neutrality begone!"" title=""Australian telcos want Netflix to pay for speed. Net neutrality begone!"" /></a> </td><td> submitted by <a href=""http://www.reddit.com/user/toiletduck""> toiletduck </a> <br/> <a href=""http://www.theaustralian.com.au/business/technology/optus-to-offer-premium-internet-service-for-video-streaming/story-e6frgakx-1227311868411"">[link]</a> <a href=""http://www.reddit.com/r/netneutrality/comments/3372fx/australian_telcos_want_netflix_to_pay_for_speed/"">[4 comments]</a> </td></tr></table>",http://www.reddit.com/r/netneutrality/comments/3372fx/australian_telcos_want_netflix_to_pay_for_speed/
