Date,Title,Description,Link
"Sat, 13 Dec 2014 19:53:10 -0800",Is there a list of common rebuttals for commonly made anti-net neutrality arguments?,"<!-- SC_OFF --><div class=""md""><p>With anti-NNers I see a good number of common arguments they fall back on which usually display a lack of understanding of the situation:</p> <ul> <li>Letting the government control the internet is socialist/other cold war buzzword</li> <li>NN by its nature would cease further investment in internet infrastructure because NN is bad mmkay</li> <li>Why do we need this <em>new</em> thing if the internet has been fine up until now?</li> </ul> <p>I&#39;m just wondering if there&#39;s a FAQ of sorts where these common arguments are soundly, factually rebutted. I&#39;m sure someone else can put these things more eloquently than myself, so I&#39;d be inclined to use a response that&#39;s been vetted for facts, phrasing, etc.</p> </div><!-- SC_ON --> submitted by <a href=""http://www.reddit.com/user/Griffolion""> Griffolion </a> <br/> <a href=""http://www.reddit.com/r/netneutrality/comments/2p8dlh/is_there_a_list_of_common_rebuttals_for_commonly/"">[link]</a> <a href=""http://www.reddit.com/r/netneutrality/comments/2p8dlh/is_there_a_list_of_common_rebuttals_for_commonly/"">[6 comments]</a>",http://www.reddit.com/r/netneutrality/comments/2p8dlh/is_there_a_list_of_common_rebuttals_for_commonly/
"Sat, 13 Dec 2014 06:34:37 -0800",How U.S. net neutrality could be an international human rights fight,"<table> <tr><td> <a href=""http://www.reddit.com/r/netneutrality/comments/2p69wh/how_us_net_neutrality_could_be_an_international/""><img src=""http://b.thumbs.redditmedia.com/Sn_Hr86g0Xx9-knAOc78i6FtHmo_ftuLFrNRXazRcRM.jpg"" alt=""How U.S. net neutrality could be an international human rights fight"" title=""How U.S. net neutrality could be an international human rights fight"" /></a> </td><td> submitted by <a href=""http://www.reddit.com/user/ourari""> ourari </a> <br/> <a href=""http://www.washingtonpost.com/blogs/the-switch/wp/2014/12/10/how-net-neutrality-could-be-a-human-rights-issue/"">[link]</a> <a href=""http://www.reddit.com/r/netneutrality/comments/2p69wh/how_us_net_neutrality_could_be_an_international/"">[1 comment]</a> </td></tr></table>",http://www.reddit.com/r/netneutrality/comments/2p69wh/how_us_net_neutrality_could_be_an_international/
"Thu, 11 Dec 2014 18:23:07 -0800",Just a little Andy Warhol NN walpaper,"<table> <tr><td> <a href=""http://www.reddit.com/r/netneutrality/comments/2p1e2m/just_a_little_andy_warhol_nn_walpaper/""><img src=""http://a.thumbs.redditmedia.com/7mHKkcGMtdx7A5bxrunJn-1fFJ_FqKK-Qxm5dBwr_v0.jpg"" alt=""Just a little Andy Warhol NN walpaper"" title=""Just a little Andy Warhol NN walpaper"" /></a> </td><td> submitted by <a href=""http://www.reddit.com/user/xpsKING""> xpsKING </a> <br/> <a href=""http://imgur.com/NP094jz"">[link]</a> <a href=""http://www.reddit.com/r/netneutrality/comments/2p1e2m/just_a_little_andy_warhol_nn_walpaper/"">[1 comment]</a> </td></tr></table>",http://www.reddit.com/r/netneutrality/comments/2p1e2m/just_a_little_andy_warhol_nn_walpaper/
"Thu, 11 Dec 2014 13:55:25 -0800",We Don't Want Netflix To Have Any Excuse': Hackers Expose Sony's War On Pirates,"<table> <tr><td> <a href=""http://www.reddit.com/r/netneutrality/comments/2p0joy/we_dont_want_netflix_to_have_any_excuse_hackers/""><img src=""http://b.thumbs.redditmedia.com/IqOjMTQZlqXyytx-FvJ41tI3N8q75so7SRTmPSOrb2c.jpg"" alt=""'We Don't Want Netflix To Have Any Excuse': Hackers Expose Sony's War On Pirates"" title=""'We Don't Want Netflix To Have Any Excuse': Hackers Expose Sony's War On Pirates"" /></a> </td><td> submitted by <a href=""http://www.reddit.com/user/wewewawa""> wewewawa </a> <br/> <a href=""http://www.forbes.com/sites/thomasbrewster/2014/12/11/inside-sony-pictures-war-on-pirates/"">[link]</a> <a href=""http://www.reddit.com/r/netneutrality/comments/2p0joy/we_dont_want_netflix_to_have_any_excuse_hackers/"">[1 comment]</a> </td></tr></table>",http://www.reddit.com/r/netneutrality/comments/2p0joy/we_dont_want_netflix_to_have_any_excuse_hackers/
"Thu, 11 Dec 2014 13:19:04 -0800",Stop Comcast from Taking Control,"<table> <tr><td> <a href=""http://www.reddit.com/r/netneutrality/comments/2p0f81/stop_comcast_from_taking_control/""><img src=""http://b.thumbs.redditmedia.com/aOREwL1X53y78ygXUXY6Onw27B06w0uP0kwSjqKJ83M.jpg"" alt=""Stop Comcast from Taking Control"" title=""Stop Comcast from Taking Control"" /></a> </td><td> submitted by <a href=""http://www.reddit.com/user/RAndrewOhge""> RAndrewOhge </a> <br/> <a href=""http://www.youtube.com/attribution_link?a=CZXBIeDF8os&amp;u=%2Fwatch%3Fv%3D6nFbbdr1pfQ%26feature%3Dshare"">[link]</a> <a href=""http://www.reddit.com/r/netneutrality/comments/2p0f81/stop_comcast_from_taking_control/"">[1 comment]</a> </td></tr></table>",http://www.reddit.com/r/netneutrality/comments/2p0f81/stop_comcast_from_taking_control/
"Thu, 11 Dec 2014 13:00:03 -0800",Pennsylvania lawmakers ask for quick approval of Comcast merger with TWC.,"<table> <tr><td> <a href=""http://www.reddit.com/r/netneutrality/comments/2p0cww/pennsylvania_lawmakers_ask_for_quick_approval_of/""><img src=""http://b.thumbs.redditmedia.com/Hs8TrPlGvrnxTsc2AtAUWQzBLEpqYZIe8Xn8ql4N2Rk.jpg"" alt=""Pennsylvania lawmakers ask for quick approval of Comcast merger with TWC."" title=""Pennsylvania lawmakers ask for quick approval of Comcast merger with TWC."" /></a> </td><td> submitted by <a href=""http://www.reddit.com/user/WalterWhiteRabbit""> WalterWhiteRabbit </a> <br/> <a href=""http://www.reuters.com/article/2014/12/11/us-tim-wrn-cab-m-a-comcast-senators-idUSKBN0JP24P20141211"">[link]</a> <a href=""http://www.reddit.com/r/netneutrality/comments/2p0cww/pennsylvania_lawmakers_ask_for_quick_approval_of/"">[1 comment]</a> </td></tr></table>",http://www.reddit.com/r/netneutrality/comments/2p0cww/pennsylvania_lawmakers_ask_for_quick_approval_of/
"Wed, 10 Dec 2014 12:46:26 -0800",List of politicians against Net Neutrality?,"<!-- SC_OFF --><div class=""md""><p>Does anyone have a list or know where one is of politicians who are openly against Net Neutrality - preferably by party? The only one I know of for sure is Ted Cruz - R.</p> </div><!-- SC_ON --> submitted by <a href=""http://www.reddit.com/user/ps6wb""> ps6wb </a> <br/> <a href=""http://www.reddit.com/r/netneutrality/comments/2owf64/list_of_politicians_against_net_neutrality/"">[link]</a> <a href=""http://www.reddit.com/r/netneutrality/comments/2owf64/list_of_politicians_against_net_neutrality/"">[4 comments]</a>",http://www.reddit.com/r/netneutrality/comments/2owf64/list_of_politicians_against_net_neutrality/
"Wed, 10 Dec 2014 09:32:23 -0800",How can Comcast run this ad given their track record?,"submitted by <a href=""http://www.reddit.com/user/evacc44""> evacc44 </a> <br/> <a href=""http://player.vimeo.com/external/112341972.hd.mp4?s=29bb21a2164f14c6f6cb7f4d450ec10e"">[link]</a> <a href=""http://www.reddit.com/r/netneutrality/comments/2ovqly/how_can_comcast_run_this_ad_given_their_track/"">[4 comments]</a>",http://www.reddit.com/r/netneutrality/comments/2ovqly/how_can_comcast_run_this_ad_given_their_track/
"Tue, 09 Dec 2014 23:57:50 -0800",Are the anti net neutrality big players trying to keep Tor slow?,"<!-- SC_OFF --><div class=""md""><p>Tor has the ability to spread wikileaks, pirated music and videos, etc, if enough servers are rented or enough computers added to the network. Without net neutrality, it could be bandwidth limited across major networks whenever it starts getting big enough to threaten their authority over the Internet.</p> </div><!-- SC_ON --> submitted by <a href=""http://www.reddit.com/user/BenRayfield""> BenRayfield </a> <br/> <a href=""http://www.reddit.com/r/netneutrality/comments/2ouhgy/are_the_anti_net_neutrality_big_players_trying_to/"">[link]</a> <a href=""http://www.reddit.com/r/netneutrality/comments/2ouhgy/are_the_anti_net_neutrality_big_players_trying_to/"">[comment]</a>",http://www.reddit.com/r/netneutrality/comments/2ouhgy/are_the_anti_net_neutrality_big_players_trying_to/
"Tue, 09 Dec 2014 22:35:24 -0800",A Song About Net Neutrality,"<table> <tr><td> <a href=""http://www.reddit.com/r/netneutrality/comments/2oubmu/a_song_about_net_neutrality/""><img src=""http://b.thumbs.redditmedia.com/l4yCA34vy70YMg5s7w6VF_LwZZmVvsvgeAjRg1jIrpQ.jpg"" alt=""A Song About Net Neutrality"" title=""A Song About Net Neutrality"" /></a> </td><td> submitted by <a href=""http://www.reddit.com/user/PlaidBass""> PlaidBass </a> <br/> <a href=""http://www.youtube.com/attribution_link?a=VFO5-_M2V6M&amp;u=%2Fwatch%3Fv%3D2P7J9WEgh7U%26feature%3Dshare"">[link]</a> <a href=""http://www.reddit.com/r/netneutrality/comments/2oubmu/a_song_about_net_neutrality/"">[1 comment]</a> </td></tr></table>",http://www.reddit.com/r/netneutrality/comments/2oubmu/a_song_about_net_neutrality/
"Tue, 09 Dec 2014 20:56:57 -0800","Writing a paper, can you help me out? I'm having a hard time outlining the issues.","<!-- SC_OFF --><div class=""md""><p>Okay, so for my AP Language class, we have to write essays/speeches on a current issue, and I chose net neutrality. I have to make an outline at the moment, and have already covered everything about fast lanes in my first body. Can you guys help me outline some of the basic arguments that I can go in depth into, to help me out? Thanks a ton! It&#39;s a bit difficult to research, since whatever I search often comes up with countless articles on Obama. </p> <p>Anyways, my outline needs to be pretty in depth, and that&#39;s why I&#39;m having so much trouble. The format is:</p> <p>I. Body</p> <p>A. Sub topic 1</p> <ol> <li><p>Paragraph 1</p></li> <li><p>Paragraph 2</p></li> <li><p>Paragraph 3</p></li> </ol> <p>B. Sub topic 2</p> <ol> <li></li> <li></li> <li></li> </ol> <p>C. Sub Topic 3</p> <ol> <li></li> <li></li> <li></li> </ol> <p>II. Body 2</p> <p>And so on and so forth. As you can see, I need a topic that can easily be chucked down, and broken up into 9 paragraphs each. Can anyone help outline any ideas for me to help me understand this? Thanks!</p> </div><!-- SC_ON --> submitted by <a href=""http://www.reddit.com/user/Study_of_Wumbology_""> Study_of_Wumbology_ </a> <br/> <a href=""http://www.reddit.com/r/netneutrality/comments/2ou2kf/writing_a_paper_can_you_help_me_out_im_having_a/"">[link]</a> <a href=""http://www.reddit.com/r/netneutrality/comments/2ou2kf/writing_a_paper_can_you_help_me_out_im_having_a/"">[3 comments]</a>",http://www.reddit.com/r/netneutrality/comments/2ou2kf/writing_a_paper_can_you_help_me_out_im_having_a/
"Tue, 09 Dec 2014 16:55:56 -0800",Does the loss of net neutrality allow me to charge more for pictures of black people streaming across my network?,"<!-- SC_OFF --><div class=""md""><p>because the loss of net neutrality lets me charge different prices for different content, and I may judge your content however I want</p> </div><!-- SC_ON --> submitted by <a href=""http://www.reddit.com/user/BenRayfield""> BenRayfield </a> <br/> <a href=""http://www.reddit.com/r/netneutrality/comments/2otc0b/does_the_loss_of_net_neutrality_allow_me_to/"">[link]</a> <a href=""http://www.reddit.com/r/netneutrality/comments/2otc0b/does_the_loss_of_net_neutrality_allow_me_to/"">[comment]</a>",http://www.reddit.com/r/netneutrality/comments/2otc0b/does_the_loss_of_net_neutrality_allow_me_to/
"Tue, 09 Dec 2014 10:25:04 -0800",Cable companies try to scare you about net neutrality in the least convincing way possible,"<table> <tr><td> <a href=""http://www.reddit.com/r/netneutrality/comments/2os00w/cable_companies_try_to_scare_you_about_net/""><img src=""http://b.thumbs.redditmedia.com/bc78Uath_8sBj9_6tej0KtXs-TArMT8WRYor-UqTabU.jpg"" alt=""Cable companies try to scare you about net neutrality in the least convincing way possible"" title=""Cable companies try to scare you about net neutrality in the least convincing way possible"" /></a> </td><td> submitted by <a href=""http://www.reddit.com/user/Paomph""> Paomph </a> <br/> <a href=""http://bgr.com/2014/12/08/cable-industry-vs-net-neutrality"">[link]</a> <a href=""http://www.reddit.com/r/netneutrality/comments/2os00w/cable_companies_try_to_scare_you_about_net/"">[comment]</a> </td></tr></table>",http://www.reddit.com/r/netneutrality/comments/2os00w/cable_companies_try_to_scare_you_about_net/
"Mon, 08 Dec 2014 10:16:08 -0800",My plea to the FCC complaint box for broadband,"<!-- SC_OFF --><div class=""md""><p>&quot;I live in a very rural area and have been living here for going on 3 years now. I have been trying to get some sort of broadband reliable internet for all of this time but I have had no luck. I am going on my second semester of college right now and will be starting online classes over my traditional classes so I absolutely need reliable internet. I once had hughesnet satellite service which was a complete waste of money because I never once hit the advertised speeds and it was constantly down, I could barely even open a web page. Now I have the satellite service Excede which only gives 20Gb a month at the most which is 120 dollars, I also hardly get past 1 mb/s(the minimum for high speed internet by FCC standards is in fact 4mb/s so this is not high speed internet as they are advertising as well). This will not cut it at all because I will have to watch full online classes, some are over an hour , and an hour of high quality video is 2.4 GB. So what that means is that after around 4 hours I am over my data cap, this is absolutely absurd. I have been looking at your site and have seen the Universal Service initiative and have also seen how President Obama is pushing for broadband internet to be a necessity for students, if this is a necessity then I should definitely have it. I have called Verizon and Comcast (which are supposed to be in my area from what the broadbandmap says, I find this to be false advertising) but they didn&#39;t know what I was talking about in anyway, . Verizon told me that they were 3000 feet from my house although my neighbor who lives right across the street has Verizon DSL so either they are lying or there data is old. I am absolutely fed up with the internet in my area and I need it if I am going to be successful in college. I hope you all get back to me quickly to help me with this situation.&quot;</p> <p>This was my plea with the FCC complaint box to maybe come and help with this situation I have also sent things to my State Rep, my mayor, the mayors whole council, and the governor. I am truly fed up with this situation my next door neighbor has verizon DSL and that would be all I would need but still they refuse to do any sort of engineer check at my location.</p> </div><!-- SC_ON --> submitted by <a href=""http://www.reddit.com/user/brandon425""> brandon425 </a> <br/> <a href=""http://www.reddit.com/r/netneutrality/comments/2oo11y/my_plea_to_the_fcc_complaint_box_for_broadband/"">[link]</a> <a href=""http://www.reddit.com/r/netneutrality/comments/2oo11y/my_plea_to_the_fcc_complaint_box_for_broadband/"">[4 comments]</a>",http://www.reddit.com/r/netneutrality/comments/2oo11y/my_plea_to_the_fcc_complaint_box_for_broadband/
"Mon, 08 Dec 2014 09:07:16 -0800",Net Neutrality Neuters the Internet,"<table> <tr><td> <a href=""http://www.reddit.com/r/netneutrality/comments/2onstb/net_neutrality_neuters_the_internet/""><img src=""http://b.thumbs.redditmedia.com/qJllYOlt1aDu0gIKw5lbIZO4SMfRtN-lIsxePJq30XE.jpg"" alt=""Net Neutrality Neuters the Internet"" title=""Net Neutrality Neuters the Internet"" /></a> </td><td> submitted by <a href=""http://www.reddit.com/user/mughat""> mughat </a> <br/> <a href=""https://www.youtube.com/watch?v=00ho5pMrc4c"">[link]</a> <a href=""http://www.reddit.com/r/netneutrality/comments/2onstb/net_neutrality_neuters_the_internet/"">[2 comments]</a> </td></tr></table>",http://www.reddit.com/r/netneutrality/comments/2onstb/net_neutrality_neuters_the_internet/
"Sun, 07 Dec 2014 07:29:10 -0800","Angela Merkel argues against net neutrality, calls for special access fast lane","submitted by <a href=""http://www.reddit.com/user/was_shadowbanned""> was_shadowbanned </a> <br/> <a href=""http://www.theverge.com/2014/12/6/7345219/angela-merkel-argues-against-net-neutrality-calls-for-special-access"">[link]</a> <a href=""http://www.reddit.com/r/netneutrality/comments/2ojz3f/angela_merkel_argues_against_net_neutrality_calls/"">[1 comment]</a>",http://www.reddit.com/r/netneutrality/comments/2ojz3f/angela_merkel_argues_against_net_neutrality_calls/
"Sat, 06 Dec 2014 10:52:13 -0800",Net Neutrality Jumbotron Delivers Message FCC Couldn’t Miss,"<table> <tr><td> <a href=""http://www.reddit.com/r/netneutrality/comments/2oh9bw/net_neutrality_jumbotron_delivers_message_fcc/""><img src=""http://b.thumbs.redditmedia.com/yj3jJNL_bHDCspzl7W1IrwsiGsf3wsfRU-iQ4JMOmXU.jpg"" alt=""Net Neutrality Jumbotron Delivers Message FCC Couldn’t Miss"" title=""Net Neutrality Jumbotron Delivers Message FCC Couldn’t Miss"" /></a> </td><td> submitted by <a href=""http://www.reddit.com/user/RAndrewOhge""> RAndrewOhge </a> <br/> <a href=""https://www.popularresistance.org/net-neutrality-jumbotron-delivers-message-fcc-couldnt-miss/"">[link]</a> <a href=""http://www.reddit.com/r/netneutrality/comments/2oh9bw/net_neutrality_jumbotron_delivers_message_fcc/"">[1 comment]</a> </td></tr></table>",http://www.reddit.com/r/netneutrality/comments/2oh9bw/net_neutrality_jumbotron_delivers_message_fcc/
"Fri, 05 Dec 2014 14:29:08 -0800",FCC to Implement Intelligence Restrictions On Internet Access,"<table> <tr><td> <a href=""http://www.reddit.com/r/netneutrality/comments/2oemxb/fcc_to_implement_intelligence_restrictions_on/""><img src=""http://a.thumbs.redditmedia.com/f5N7pjzkCzSKLgo9UUIRslJX5R-nxmWSQOzwzvi3us4.jpg"" alt=""FCC to Implement Intelligence Restrictions On Internet Access"" title=""FCC to Implement Intelligence Restrictions On Internet Access"" /></a> </td><td> submitted by <a href=""http://www.reddit.com/user/MrTwinkler""> MrTwinkler </a> <br/> <a href=""http://www.saltybadger.com/2014/12/fcc-to-implement-intelligent.html"">[link]</a> <a href=""http://www.reddit.com/r/netneutrality/comments/2oemxb/fcc_to_implement_intelligence_restrictions_on/"">[2 comments]</a> </td></tr></table>",http://www.reddit.com/r/netneutrality/comments/2oemxb/fcc_to_implement_intelligence_restrictions_on/
"Fri, 05 Dec 2014 13:19:56 -0800",A Net Neutrality Jumbotron Delivers a Message the FCC Couldn't Miss,"<table> <tr><td> <a href=""http://www.reddit.com/r/netneutrality/comments/2oeezp/a_net_neutrality_jumbotron_delivers_a_message_the/""><img src=""http://b.thumbs.redditmedia.com/q-7HzWEMdvpuHicnlzLM61hXuoUqfjWBSoD6e3XPlII.jpg"" alt=""A Net Neutrality Jumbotron Delivers a Message the FCC Couldn't Miss"" title=""A Net Neutrality Jumbotron Delivers a Message the FCC Couldn't Miss"" /></a> </td><td> submitted by <a href=""http://www.reddit.com/user/TheBeard_""> TheBeard_ </a> <br/> <a href=""http://www.freepress.net/blog/2014/12/05/net-neutrality-jumbotron-delivers-message-fcc-couldnt-miss"">[link]</a> <a href=""http://www.reddit.com/r/netneutrality/comments/2oeezp/a_net_neutrality_jumbotron_delivers_a_message_the/"">[comment]</a> </td></tr></table>",http://www.reddit.com/r/netneutrality/comments/2oeezp/a_net_neutrality_jumbotron_delivers_a_message_the/
"Fri, 05 Dec 2014 02:51:38 -0800",German Chancellor Angela Merkel Speaks Out Against Net Neutrality,"<table> <tr><td> <a href=""http://www.reddit.com/r/netneutrality/comments/2ocrjl/german_chancellor_angela_merkel_speaks_out/""><img src=""http://b.thumbs.redditmedia.com/7s-x9M76x4PsKpX1mNfaUnqdW15--B8mtQdPwtjggbE.jpg"" alt=""German Chancellor Angela Merkel Speaks Out Against Net Neutrality"" title=""German Chancellor Angela Merkel Speaks Out Against Net Neutrality"" /></a> </td><td> submitted by [deleted] <br/> <a href=""http://www.thelocal.de/20141204/merkel-speaks-out-against-net-neutrality"">[link]</a> <a href=""http://www.reddit.com/r/netneutrality/comments/2ocrjl/german_chancellor_angela_merkel_speaks_out/"">[comment]</a> </td></tr></table>",http://www.reddit.com/r/netneutrality/comments/2ocrjl/german_chancellor_angela_merkel_speaks_out/
"Thu, 04 Dec 2014 08:30:28 -0800","Broadband providers hate regulations, except when it helps them","<table> <tr><td> <a href=""http://www.reddit.com/r/netneutrality/comments/2o9rls/broadband_providers_hate_regulations_except_when/""><img src=""http://a.thumbs.redditmedia.com/XEWCVtKdyesdBx3I0QGPRD6YxeBjrCDrPanMCJtPug8.jpg"" alt=""Broadband providers hate regulations, except when it helps them"" title=""Broadband providers hate regulations, except when it helps them"" /></a> </td><td> submitted by <a href=""http://www.reddit.com/user/TaxDawg""> TaxDawg </a> <br/> <a href=""http://www.androidauthority.com/broadband-providers-hate-regulations-except-helps-570888/"">[link]</a> <a href=""http://www.reddit.com/r/netneutrality/comments/2o9rls/broadband_providers_hate_regulations_except_when/"">[comment]</a> </td></tr></table>",http://www.reddit.com/r/netneutrality/comments/2o9rls/broadband_providers_hate_regulations_except_when/
"Thu, 04 Dec 2014 07:36:46 -0800",Net Neutrality in the EU – A work still in progress - The Public Privacy,"<table> <tr><td> <a href=""http://www.reddit.com/r/netneutrality/comments/2o9lxt/net_neutrality_in_the_eu_a_work_still_in_progress/""><img src=""http://a.thumbs.redditmedia.com/7FqSi1YgLcuuSedGz8O3BgAa_xuLiHeR_hNZryx_Tk0.jpg"" alt=""Net Neutrality in the EU – A work still in progress - The Public Privacy"" title=""Net Neutrality in the EU – A work still in progress - The Public Privacy"" /></a> </td><td> submitted by <a href=""http://www.reddit.com/user/pedroredditfun""> pedroredditfun </a> <br/> <a href=""http://thepublicprivacy.com/2014/11/30/net-neutrality-eu-work-still-progress/"">[link]</a> <a href=""http://www.reddit.com/r/netneutrality/comments/2o9lxt/net_neutrality_in_the_eu_a_work_still_in_progress/"">[comment]</a> </td></tr></table>",http://www.reddit.com/r/netneutrality/comments/2o9lxt/net_neutrality_in_the_eu_a_work_still_in_progress/
"Wed, 03 Dec 2014 17:17:40 -0800","Is Verizon's entire FiOS FTTP, fiber to the premises networks are already Title II, common carriage, telecommunications service -- and they never told the public or the FCC or the courts?","submitted by <a href=""http://www.reddit.com/user/Jennifer_S_Lawrence""> Jennifer_S_Lawrence </a> <br/> <a href=""http://www.reddit.com/r/netneutrality/comments/2o7pml/is_verizons_entire_fios_fttp_fiber_to_the/"">[link]</a> <a href=""http://www.reddit.com/r/netneutrality/comments/2o7pml/is_verizons_entire_fios_fttp_fiber_to_the/"">[comment]</a>",http://www.reddit.com/r/netneutrality/comments/2o7pml/is_verizons_entire_fios_fttp_fiber_to_the/
"Wed, 03 Dec 2014 10:16:01 -0800",Could we please start outing companies that are openly against Net Neutrality?,"<!-- SC_OFF --><div class=""md""><p>Dear Reddit,</p> <p>I know you love net neutrality and so do I. So let&#39;s go all Nazi on companies that don&#39;t for the sake of profit. Companies make sure their interest gets heard and so should we.</p> <p>Here&#39;s the letter printed in the current issue of The Economist that sparked this train of thought:</p> <p>Don&#39;t be neutral SIR – As a pro-business publication, I believe that The Economist should be championing the removal of net neutrality (“Not neutral about net neutrality”, November 15th). “Neutrality” does not work in any comparable industry, so why is the internet an exception? Take postal services. If a business wants a parcel delivered by the standard service, Royal Mail will happily deliver it over a couple of days. If you want it guaranteed the next day, you pay extra.</p> <p>It is the same with toll roads and business-class fares. You pay a premium for a premium service. This system has worked well and produced choice, innovation and competition that has benefited customers. The same will be true for the internet. Net neutrality has had its day and it is now stifling progress.</p> <p>Chris Goswami Director of marketing Openwave Mobility Styal, Cheshire</p> <p>After reading this I came to the conclusion that companies, like &quot;Openwave Mobility&quot; (<a href=""https://www.facebook.com/owmobility"">https://www.facebook.com/owmobility</a>) for instance, would be more than happy to receive countless messages about how and why they are wrong.</p> <p>Your thoughts?</p> </div><!-- SC_ON --> submitted by <a href=""http://www.reddit.com/user/Naldmann""> Naldmann </a> <br/> <a href=""http://www.reddit.com/r/netneutrality/comments/2o6b02/could_we_please_start_outing_companies_that_are/"">[link]</a> <a href=""http://www.reddit.com/r/netneutrality/comments/2o6b02/could_we_please_start_outing_companies_that_are/"">[2 comments]</a>",http://www.reddit.com/r/netneutrality/comments/2o6b02/could_we_please_start_outing_companies_that_are/
"Tue, 02 Dec 2014 16:48:15 -0800","Net Neutrality: Yes, but never under Title II","<!-- SC_OFF --><div class=""md""><p><a href=""http://www.dailypilot.com/opinion/tn-dpt-me-1207-commentary2-20141202,0,6278728.story"">http://www.dailypilot.com/opinion/tn-dpt-me-1207-commentary2-20141202,0,6278728.story</a></p> </div><!-- SC_ON --> submitted by <a href=""http://www.reddit.com/user/mg92661""> mg92661 </a> <br/> <a href=""http://www.reddit.com/r/netneutrality/comments/2o3rkq/net_neutrality_yes_but_never_under_title_ii/"">[link]</a> <a href=""http://www.reddit.com/r/netneutrality/comments/2o3rkq/net_neutrality_yes_but_never_under_title_ii/"">[2 comments]</a>",http://www.reddit.com/r/netneutrality/comments/2o3rkq/net_neutrality_yes_but_never_under_title_ii/
