Date,Title,Description,Link
"Sat, 28 Feb 2015 11:12:05 -0800","The battle is not over. Let's not forget the corporations that fought net neutrality. Boycott AT&T, Verizon, and Comcast XFINITY.","submitted by <a href=""http://www.reddit.com/user/ryandouglasrosecopy""> ryandouglasrosecopy </a> <br/> <a href=""http://www.reddit.com/r/netneutrality/comments/2xhhjd/the_battle_is_not_over_lets_not_forget_the/"">[link]</a> <a href=""http://www.reddit.com/r/netneutrality/comments/2xhhjd/the_battle_is_not_over_lets_not_forget_the/"">[9 comments]</a>",http://www.reddit.com/r/netneutrality/comments/2xhhjd/the_battle_is_not_over_lets_not_forget_the/
"Sat, 28 Feb 2015 07:07:24 -0800",My reaction to Verizon's anti-net-neutrality morse code hissyfit,"<table> <tr><td> <a href=""http://www.reddit.com/r/netneutrality/comments/2xgqvf/my_reaction_to_verizons_antinetneutrality_morse/""><img src=""http://b.thumbs.redditmedia.com/dZ8ekY9CfMtJi9u211bNXBDe_cpQrCkZQnJFvpr2OMY.jpg"" alt=""My reaction to Verizon's anti-net-neutrality morse code hissyfit"" title=""My reaction to Verizon's anti-net-neutrality morse code hissyfit"" /></a> </td><td> submitted by <a href=""http://www.reddit.com/user/fongaboo""> fongaboo </a> <br/> <a href=""http://sync.fongaboo.com/0215/-..%20.%20.-%20.-..%20%20.--%20..%20-%20....%20%20..%20-.gif"">[link]</a> <a href=""http://www.reddit.com/r/netneutrality/comments/2xgqvf/my_reaction_to_verizons_antinetneutrality_morse/"">[1 comment]</a> </td></tr></table>",http://www.reddit.com/r/netneutrality/comments/2xgqvf/my_reaction_to_verizons_antinetneutrality_morse/
"Fri, 27 Feb 2015 20:30:02 -0800","I support Net neutrality, but that is not what the FCC just did","<table> <tr><td> <a href=""http://www.reddit.com/r/netneutrality/comments/2xfksw/i_support_net_neutrality_but_that_is_not_what_the/""><img src=""http://b.thumbs.redditmedia.com/IGROP6kCu7reAKMrswOgkeY9rxarfGX4V40WkiKfoBc.jpg"" alt=""I support Net neutrality, but that is not what the FCC just did"" title=""I support Net neutrality, but that is not what the FCC just did"" /></a> </td><td> submitted by <a href=""http://www.reddit.com/user/CharlietheVIII""> CharlietheVIII </a> <br/> <a href=""http://www.appy-geek.com/Web/ArticleWeb.aspx?regionid=1&amp;articleid=36874748"">[link]</a> <a href=""http://www.reddit.com/r/netneutrality/comments/2xfksw/i_support_net_neutrality_but_that_is_not_what_the/"">[2 comments]</a> </td></tr></table>",http://www.reddit.com/r/netneutrality/comments/2xfksw/i_support_net_neutrality_but_that_is_not_what_the/
"Fri, 27 Feb 2015 20:17:15 -0800","With FCC victory, now is the time to fight Data Caps","<table> <tr><td> <a href=""http://www.reddit.com/r/netneutrality/comments/2xfjnp/with_fcc_victory_now_is_the_time_to_fight_data/""><img src=""http://b.thumbs.redditmedia.com/t4MrKujsTmuXpO7Bhdr3i-B5kPRrUmO3J52FA4epLMk.jpg"" alt=""With FCC victory, now is the time to fight Data Caps"" title=""With FCC victory, now is the time to fight Data Caps"" /></a> </td><td> submitted by <a href=""http://www.reddit.com/user/will-dearborn""> will-dearborn </a> <br/> <a href=""http://thedigitaldetour.com/blog/2015/2/27/yvvmgkoqio26jferohqt9g9m70dfua"">[link]</a> <a href=""http://www.reddit.com/r/netneutrality/comments/2xfjnp/with_fcc_victory_now_is_the_time_to_fight_data/"">[3 comments]</a> </td></tr></table>",http://www.reddit.com/r/netneutrality/comments/2xfjnp/with_fcc_victory_now_is_the_time_to_fight_data/
"Fri, 27 Feb 2015 18:49:46 -0800",Did the FCC Sing Kumbaya After Passing Net Neutrality?,"<table> <tr><td> <a href=""http://www.reddit.com/r/netneutrality/comments/2xfaxz/did_the_fcc_sing_kumbaya_after_passing_net/""><img src=""http://b.thumbs.redditmedia.com/HvLbnCIOiDiUdw8QTSAW-7Cao78aDyzZOH5MT63gN-k.jpg"" alt=""Did the FCC Sing Kumbaya After Passing Net Neutrality?"" title=""Did the FCC Sing Kumbaya After Passing Net Neutrality?"" /></a> </td><td> submitted by <a href=""http://www.reddit.com/user/RAndrewOhge""> RAndrewOhge </a> <br/> <a href=""http://www.youtube.com/attribution_link?a=38Cj3olfsp4&amp;u=%2Fwatch%3Fv%3DRTKWNyB4-9U%26feature%3Dshare"">[link]</a> <a href=""http://www.reddit.com/r/netneutrality/comments/2xfaxz/did_the_fcc_sing_kumbaya_after_passing_net/"">[1 comment]</a> </td></tr></table>",http://www.reddit.com/r/netneutrality/comments/2xfaxz/did_the_fcc_sing_kumbaya_after_passing_net/
"Fri, 27 Feb 2015 18:43:38 -0800",How the Government and Media Are Lying About Net Neutrality,"<table> <tr><td> <a href=""http://www.reddit.com/r/netneutrality/comments/2xfa91/how_the_government_and_media_are_lying_about_net/""><img src=""http://b.thumbs.redditmedia.com/NrMvNemUlKt94-5_L7ZyKhMX2DJk7ZXFzSnjMCUyjto.jpg"" alt=""How the Government and Media Are Lying About Net Neutrality"" title=""How the Government and Media Are Lying About Net Neutrality"" /></a> </td><td> submitted by <a href=""http://www.reddit.com/user/RAndrewOhge""> RAndrewOhge </a> <br/> <a href=""http://www.youtube.com/attribution_link?a=IjCriPgCQrI&amp;u=%2Fwatch%3Fv%3DzoctW8lCDc8%26feature%3Dshare"">[link]</a> <a href=""http://www.reddit.com/r/netneutrality/comments/2xfa91/how_the_government_and_media_are_lying_about_net/"">[2 comments]</a> </td></tr></table>",http://www.reddit.com/r/netneutrality/comments/2xfa91/how_the_government_and_media_are_lying_about_net/
"Fri, 27 Feb 2015 18:41:47 -0800",FCC Votes in Favor of Net Neutrality,"<table> <tr><td> <a href=""http://www.reddit.com/r/netneutrality/comments/2xfa20/fcc_votes_in_favor_of_net_neutrality/""><img src=""http://b.thumbs.redditmedia.com/jT4r6EYOdQzZRX_gNMwSN-8fRnqm0mjLMCoCFF9tG7A.jpg"" alt=""FCC Votes in Favor of Net Neutrality"" title=""FCC Votes in Favor of Net Neutrality"" /></a> </td><td> submitted by <a href=""http://www.reddit.com/user/rerog3030""> rerog3030 </a> <br/> <a href=""http://www.abridgeme.com/article-details/fcc-votes-in-favor-of-net-neutrality-ujxz#sthash.j4oFYbzj.sfju"">[link]</a> <a href=""http://www.reddit.com/r/netneutrality/comments/2xfa20/fcc_votes_in_favor_of_net_neutrality/"">[1 comment]</a> </td></tr></table>",http://www.reddit.com/r/netneutrality/comments/2xfa20/fcc_votes_in_favor_of_net_neutrality/
"Fri, 27 Feb 2015 18:39:14 -0800",Editorial cartoon from Houston Chronicle,"<!-- SC_OFF --><div class=""md""><p><a href=""http://blog.chron.com/nickanderson/2015/02/scare-tactics/"">http://blog.chron.com/nickanderson/2015/02/scare-tactics/</a></p> </div><!-- SC_ON --> submitted by <a href=""http://www.reddit.com/user/marzolian""> marzolian </a> <br/> <a href=""http://www.reddit.com/r/netneutrality/comments/2xf9su/editorial_cartoon_from_houston_chronicle/"">[link]</a> <a href=""http://www.reddit.com/r/netneutrality/comments/2xf9su/editorial_cartoon_from_houston_chronicle/"">[1 comment]</a>",http://www.reddit.com/r/netneutrality/comments/2xf9su/editorial_cartoon_from_houston_chronicle/
"Fri, 27 Feb 2015 18:38:13 -0800",Comcast paid for an ad on Google saying they support Net Neutrality,"<table> <tr><td> <a href=""http://www.reddit.com/r/netneutrality/comments/2xf9ox/comcast_paid_for_an_ad_on_google_saying_they/""><img src=""http://b.thumbs.redditmedia.com/iD3ujx80F-8LfISDLCcXGHiaa-31xdmNpGvmCkApF1w.jpg"" alt=""Comcast paid for an ad on Google saying they support Net Neutrality"" title=""Comcast paid for an ad on Google saying they support Net Neutrality"" /></a> </td><td> submitted by <a href=""http://www.reddit.com/user/mattrickcode""> mattrickcode </a> <br/> <a href=""http://i.imgur.com/h0BYQaE.png"">[link]</a> <a href=""http://www.reddit.com/r/netneutrality/comments/2xf9ox/comcast_paid_for_an_ad_on_google_saying_they/"">[1 comment]</a> </td></tr></table>",http://www.reddit.com/r/netneutrality/comments/2xf9ox/comcast_paid_for_an_ad_on_google_saying_they/
"Fri, 27 Feb 2015 18:02:49 -0800",AT&T's response to Net Neutrality,"submitted by <a href=""http://www.reddit.com/user/pepesilvia89""> pepesilvia89 </a> <br/> <a href=""http://www.attpublicpolicy.com/broadband-classification/thoughts-on-todays-vote/"">[link]</a> <a href=""http://www.reddit.com/r/netneutrality/comments/2xf601/atts_response_to_net_neutrality/"">[comment]</a>",http://www.reddit.com/r/netneutrality/comments/2xf601/atts_response_to_net_neutrality/
"Fri, 27 Feb 2015 17:19:26 -0800","What color is that dress?? Oh wait, where did our Internet rights go!?","<!-- SC_OFF --><div class=""md""><p>While everyone is so focused on debating the color of a dress in a photo taken from a camera with terrible settings, the federal government slowly creeps in to steal away even more of our Internet rights, like a raccoon at your cat&#39;s food dish in the middle of the night.</p> </div><!-- SC_ON --> submitted by <a href=""http://www.reddit.com/user/maitreg""> maitreg </a> <br/> <a href=""http://www.reddit.com/r/netneutrality/comments/2xf1e7/what_color_is_that_dress_oh_wait_where_did_our/"">[link]</a> <a href=""http://www.reddit.com/r/netneutrality/comments/2xf1e7/what_color_is_that_dress_oh_wait_where_did_our/"">[5 comments]</a>",http://www.reddit.com/r/netneutrality/comments/2xf1e7/what_color_is_that_dress_oh_wait_where_did_our/
"Fri, 27 Feb 2015 15:42:43 -0800",So do we get to read the document now?,"<!-- SC_OFF --><div class=""md""><p>My dad is arguing with me about how Net Neutrality is bad, and I think actually showing him the document would help clear up misconceptions. In fact, I&#39;m wondering if seeing the actual document will help educate everyone who is against Net Neutrality. Do you think it will get released, and if not, do you guys think we can get it released?</p> </div><!-- SC_ON --> submitted by <a href=""http://www.reddit.com/user/musicninja91""> musicninja91 </a> <br/> <a href=""http://www.reddit.com/r/netneutrality/comments/2xeqnn/so_do_we_get_to_read_the_document_now/"">[link]</a> <a href=""http://www.reddit.com/r/netneutrality/comments/2xeqnn/so_do_we_get_to_read_the_document_now/"">[1 comment]</a>",http://www.reddit.com/r/netneutrality/comments/2xeqnn/so_do_we_get_to_read_the_document_now/
"Fri, 27 Feb 2015 14:42:50 -0800",Following net neutrality from FDR to Obama,"submitted by <a href=""http://www.reddit.com/user/sachalu""> sachalu </a> <br/> <a href=""http://www.theverge.com/2015/2/27/8118279/net-neutrality-history-fdr-to-obama-title-ii"">[link]</a> <a href=""http://www.reddit.com/r/netneutrality/comments/2xejb1/following_net_neutrality_from_fdr_to_obama/"">[comment]</a>",http://www.reddit.com/r/netneutrality/comments/2xejb1/following_net_neutrality_from_fdr_to_obama/
"Fri, 27 Feb 2015 12:42:29 -0800",Net neutrality: FCC and Obama take the internet back to the 1930s,"<table> <tr><td> <a href=""http://www.reddit.com/r/netneutrality/comments/2xe3gi/net_neutrality_fcc_and_obama_take_the_internet/""><img src=""http://b.thumbs.redditmedia.com/XuqakwZRGiZooRBi-g4R96FbW49nN15AEFXpJPgpfTs.jpg"" alt=""Net neutrality: FCC and Obama take the internet back to the 1930s"" title=""Net neutrality: FCC and Obama take the internet back to the 1930s"" /></a> </td><td> submitted by <a href=""http://www.reddit.com/user/antdude""> antdude </a> <br/> <a href=""http://www.youtube.com/watch?v=Zf-WFrkBs1g"">[link]</a> <a href=""http://www.reddit.com/r/netneutrality/comments/2xe3gi/net_neutrality_fcc_and_obama_take_the_internet/"">[1 comment]</a> </td></tr></table>",http://www.reddit.com/r/netneutrality/comments/2xe3gi/net_neutrality_fcc_and_obama_take_the_internet/
"Fri, 27 Feb 2015 11:43:43 -0800",Net Neutrality Vote in the FCC: You Lose America | The Daily Sheeple,"<table> <tr><td> <a href=""http://www.reddit.com/r/netneutrality/comments/2xdvjr/net_neutrality_vote_in_the_fcc_you_lose_america/""><img src=""http://a.thumbs.redditmedia.com/07-y0fCDGl4ijriZCU5L96SODceVLvhtDeGPPkmrZR0.jpg"" alt=""Net Neutrality Vote in the FCC: You Lose America | The Daily Sheeple"" title=""Net Neutrality Vote in the FCC: You Lose America | The Daily Sheeple"" /></a> </td><td> submitted by <a href=""http://www.reddit.com/user/RAndrewOhge""> RAndrewOhge </a> <br/> <a href=""http://www.thedailysheeple.com/net-neutrality-vote-in-the-fcc-you-lose-america_022015#sthash.TqIwwYxt.sfju"">[link]</a> <a href=""http://www.reddit.com/r/netneutrality/comments/2xdvjr/net_neutrality_vote_in_the_fcc_you_lose_america/"">[2 comments]</a> </td></tr></table>",http://www.reddit.com/r/netneutrality/comments/2xdvjr/net_neutrality_vote_in_the_fcc_you_lose_america/
"Fri, 27 Feb 2015 11:07:13 -0800",Verizon called out on its BS,"<table> <tr><td> <a href=""http://www.reddit.com/r/netneutrality/comments/2xdqqk/verizon_called_out_on_its_bs/""><img src=""http://b.thumbs.redditmedia.com/Rv95jUrAMLvnFxFfdbCRTa8WDlyCMLMBMX1KmxrLxHw.jpg"" alt=""Verizon called out on its BS"" title=""Verizon called out on its BS"" /></a> </td><td> submitted by <a href=""http://www.reddit.com/user/MasterMyself""> MasterMyself </a> <br/> <a href=""http://www.maximumpc.com/fcc_tom_wheeler_net_neutrality_verizon_2015"">[link]</a> <a href=""http://www.reddit.com/r/netneutrality/comments/2xdqqk/verizon_called_out_on_its_bs/"">[4 comments]</a> </td></tr></table>",http://www.reddit.com/r/netneutrality/comments/2xdqqk/verizon_called_out_on_its_bs/
"Fri, 27 Feb 2015 10:55:52 -0800","So you really think what we got was ""net neutrality""? Read this tell me what you think. I'm not sure what to believe.","<table> <tr><td> <a href=""http://www.reddit.com/r/netneutrality/comments/2xdp62/so_you_really_think_what_we_got_was_net/""><img src=""http://b.thumbs.redditmedia.com/yzAdwsn87mOz7yDfrH3NWGZqac_qFEOVObHQMePyIpo.jpg"" alt=""So you really think what we got was &quot;net neutrality&quot;? Read this tell me what you think. I'm not sure what to believe."" title=""So you really think what we got was &quot;net neutrality&quot;? Read this tell me what you think. I'm not sure what to believe."" /></a> </td><td> submitted by <a href=""http://www.reddit.com/user/upintheair_""> upintheair_ </a> <br/> <a href=""http://tucker.liberty.me/2015/02/26/net-neutrality-triumph-of-the-ruling-class/#.VPCiDkx1tjU.linkedin"">[link]</a> <a href=""http://www.reddit.com/r/netneutrality/comments/2xdp62/so_you_really_think_what_we_got_was_net/"">[1 comment]</a> </td></tr></table>",http://www.reddit.com/r/netneutrality/comments/2xdp62/so_you_really_think_what_we_got_was_net/
"Fri, 27 Feb 2015 09:58:11 -0800",There’s already a conspiracy theory brewing over net neutrality,"<table> <tr><td> <a href=""http://www.reddit.com/r/netneutrality/comments/2xdh5z/theres_already_a_conspiracy_theory_brewing_over/""><img src=""http://b.thumbs.redditmedia.com/bK2wu92fsxEddViGcG6BaSx1RbJcK4m8ETdtPBqnMhc.jpg"" alt=""There’s already a conspiracy theory brewing over net neutrality"" title=""There’s already a conspiracy theory brewing over net neutrality"" /></a> </td><td> submitted by <a href=""http://www.reddit.com/user/A1CEO""> A1CEO </a> <br/> <a href=""http://www.washingtonpost.com/blogs/the-switch/wp/2015/02/27/theres-already-a-conspiracy-theory-brewing-over-net-neutrality/?hpid=z14"">[link]</a> <a href=""http://www.reddit.com/r/netneutrality/comments/2xdh5z/theres_already_a_conspiracy_theory_brewing_over/"">[comment]</a> </td></tr></table>",http://www.reddit.com/r/netneutrality/comments/2xdh5z/theres_already_a_conspiracy_theory_brewing_over/
"Fri, 27 Feb 2015 09:54:28 -0800",another net neutrality vote update,"submitted by <a href=""http://www.reddit.com/user/SwansonDog""> SwansonDog </a> <br/> <a href=""http://www.exitevent.com/article/summary-of-net-neutrality-150227"">[link]</a> <a href=""http://www.reddit.com/r/netneutrality/comments/2xdgmk/another_net_neutrality_vote_update/"">[comment]</a>",http://www.reddit.com/r/netneutrality/comments/2xdgmk/another_net_neutrality_vote_update/
"Fri, 27 Feb 2015 09:01:45 -0800",What are interLATA fees and where to learn more? Any other advice/info is appreciated.,"<!-- SC_OFF --><div class=""md""><p>I have been going back and forth with one of my friends about the decision. He is a lot more technically sound than I am and has been in the space a lot longer. He sent this to me:</p> <blockquote> <p>&quot;NetFlix launches their OTT service. Consumers love it and flock to it (as I did, and Hulu and ESP etc etc). Here was the unintended consequence. Each SP pays interLATA fees as defined in FCC CFRs. In the case of Netflix they were transporting via Level 3. So, what right? Here is what occurred. YouTube and Netflix traffic spiked over the inter LATA, each SP has to pay reciprocal interLATA transport fees which are built into the cost of your and my monthly fee. No problem. Except that the interLATA fees spiked 200-300% to the SP&#39;s. The business model quickly broke. Now, your and my $99 a month fee no longer created a positive cash flow for the SP&#39;s in fact many including BHN, TWC and VZ were losing money. So, Comcast (the criminals who produce MSNBC) starting throttling data and got caught. Shame on them and I am glad they were caught. But, the interLATA fee problem still existed. Then, caching to the rescue. Both Google and Netflix went to all the SP&#39;s and presented a deal we will provide you with caching servers on prem at your location, free of charge...except a year later after these caching systems were in everyone’s data centers the NTFLX and GOOG sales team handed the SP&#39;s a renewal bill. I have no personal interest in the internet being a utility. That is my personal feeling. Some may feel differently. I do not believe the federal government is either efficient or cutting edge and I question the motives behind this.&quot;</p> </blockquote> <p>So basically what he is saying is that the decision is not right because of the increasing cost to providers? Is there additional info that is available that I can read up on about the fees? Any advice on how to learn more (or respond to his points) about this is welcome. I am happy about the decision, but I feel like I don&#39;t have all the facts now.</p> </div><!-- SC_ON --> submitted by <a href=""http://www.reddit.com/user/iwillnotlurk""> iwillnotlurk </a> <br/> <a href=""http://www.reddit.com/r/netneutrality/comments/2xd960/what_are_interlata_fees_and_where_to_learn_more/"">[link]</a> <a href=""http://www.reddit.com/r/netneutrality/comments/2xd960/what_are_interlata_fees_and_where_to_learn_more/"">[1 comment]</a>",http://www.reddit.com/r/netneutrality/comments/2xd960/what_are_interlata_fees_and_where_to_learn_more/
"Fri, 27 Feb 2015 07:48:33 -0800","Feel free to educate Verizon's media contact, Ed McFadden @ 202-515-2441","<!-- SC_OFF --><div class=""md""><p>Verizon issued a <a href=""http://publicpolicy.verizon.com/assets/docs/VZ_NR_--_2-26-15_VZ_Statement_on_Open_Internet_Order_FINAL_1.pdf"">sarcastic press release</a> in response to Title II classification.</p> <p>They (Michael E. Glover, Verizon SVP Public Policy and Government Affairs) claim that the FCC&#39;s decision </p> <blockquote> <p>&quot;presages a time of uncertainty for consumers, innovators and investors&quot;</p> </blockquote> <p>On the contrary, the FCC&#39;s decision makes the future of the Internet more certain. It prevents Verizon from shaping the content we see based on who pays the most. It protects a variety of political speech and entertainment media, shielding consumers from moneyed interests who would stifle their lesser-funded adversaries and lobby to us inside our own homes.</p> <p>It preserves the equal playing field that has enabled small companies to compete with big ones. Equality Verizon has worked to destroy. As Vint Cerf, co-creator of the TCP/IP protocol that underpins the entire Internet, said:</p> <blockquote> <p><strong>The remarkable social impact and economic success of the Internet is in many ways directly attributable to the architectural characteristics that were part of its design. The Internet was designed with no gatekeepers over new content or services.</strong> The Internet is based on a layered, end-to-end model that allows people at each level of the network to innovate free of any central control. By placing intelligence at the edges rather than control in the middle of the network, the Internet has created a platform for innovation. This has led to an explosion of offerings – from VOIP to 802.11x wi-fi to blogging – that might never have evolved had central control of the network been required by design. <a href=""http://googleblog.blogspot.com/2005/11/vint-cerf-speaks-out-on-net-neutrality.html"">(source)</a></p> </blockquote> <p>Verizon says,</p> <blockquote> <p>What has been and will remain constant before, during and after the existence of any regulations is Verizon’s commitment to an open Internet that provides consumers with competitive broadband choices and Internet access when, where, and how they want.</p> </blockquote> <p>This is a disconnect between what Verizon wants and what consumers want. Verizon fails to acknowledge that, of the record-breaking 4 million public comments to the FCC, <a href=""http://bits.blogs.nytimes.com/2014/09/18/net-neutrality-comments-to-f-c-c-overwhelmingly-one-sided-study-says/"">an estimated fewer than 1% took their side</a>.</p> <p>Moreover, there&#39;s a disconnect between what Verizon <em>says</em> and what they do. </p> <ul> <li><a href=""http://knowmore.washingtonpost.com/2014/04/25/this-hilarious-graph-of-netflix-speeds-shows-the-importance-of-net-neutrality/"">This hilarious graph of Netflix speeds shows the importance of net neutrality</a></li> <li><a href=""http://www.extremetech.com/computing/186576-verizon-caught-throttling-netflix-traffic-even-after-its-pays-for-more-bandwidth"">Verizon caught throttling Netflix traffic even after its pays for more bandwidth</a></li> </ul> <p>Verizon&#39;s media contact, Ed McFadden, included his phone number: 202-515-2441. Please feel free to correct the misconceptions he published and ask why Verizon keeps misleading the public.</p> <p>(If you&#39;re not sure what Net Neutrality&#39;s about, see John Oliver&#39;s <a href=""https://www.youtube.com/watch?v=fpbOEoRrHyU"">simple and funny explanation</a>.)</p> </div><!-- SC_ON --> submitted by <a href=""http://www.reddit.com/user/hahanawmsayin""> hahanawmsayin </a> <br/> <a href=""http://www.reddit.com/r/netneutrality/comments/2xczrf/feel_free_to_educate_verizons_media_contact_ed/"">[link]</a> <a href=""http://www.reddit.com/r/netneutrality/comments/2xczrf/feel_free_to_educate_verizons_media_contact_ed/"">[comment]</a>",http://www.reddit.com/r/netneutrality/comments/2xczrf/feel_free_to_educate_verizons_media_contact_ed/
"Fri, 27 Feb 2015 07:24:28 -0800",Why Net Neutrality is so important for digital content producers?,"<table> <tr><td> <a href=""http://www.reddit.com/r/netneutrality/comments/2xcwxr/why_net_neutrality_is_so_important_for_digital/""><img src=""http://b.thumbs.redditmedia.com/U4UJQJUWMYtHfqa10oKicKlKwnoe6CvVmnOHJTyRFuI.jpg"" alt=""Why Net Neutrality is so important for digital content producers?"" title=""Why Net Neutrality is so important for digital content producers?"" /></a> </td><td> submitted by <a href=""http://www.reddit.com/user/digiwiz""> digiwiz </a> <br/> <a href=""http://inplayer.com/newsblog/net-neutrality-important-for-digital-content-producers"">[link]</a> <a href=""http://www.reddit.com/r/netneutrality/comments/2xcwxr/why_net_neutrality_is_so_important_for_digital/"">[comment]</a> </td></tr></table>",http://www.reddit.com/r/netneutrality/comments/2xcwxr/why_net_neutrality_is_so_important_for_digital/
"Fri, 27 Feb 2015 07:07:05 -0800",Serious question: Can someone please explain where this idea comes from? Does it have any merit?,"<table> <tr><td> <a href=""http://www.reddit.com/r/netneutrality/comments/2xcut5/serious_question_can_someone_please_explain_where/""><img src=""http://b.thumbs.redditmedia.com/T9qjkte1nmdK812CYuIB7Htlt54OUA4FCKWzPNu6Z2I.jpg"" alt=""Serious question: Can someone please explain where this idea comes from? Does it have any merit?"" title=""Serious question: Can someone please explain where this idea comes from? Does it have any merit?"" /></a> </td><td> submitted by <a href=""http://www.reddit.com/user/Trollin4Lyfe""> Trollin4Lyfe </a> <br/> <a href=""http://i.imgur.com/7NLKu38.png"">[link]</a> <a href=""http://www.reddit.com/r/netneutrality/comments/2xcut5/serious_question_can_someone_please_explain_where/"">[1 comment]</a> </td></tr></table>",http://www.reddit.com/r/netneutrality/comments/2xcut5/serious_question_can_someone_please_explain_where/
"Fri, 27 Feb 2015 06:45:46 -0800",Stop Net Neutrality because reasons and stuff.,"<table> <tr><td> <a href=""http://www.reddit.com/r/netneutrality/comments/2xcsbg/stop_net_neutrality_because_reasons_and_stuff/""><img src=""http://b.thumbs.redditmedia.com/FKefKez6IsHAgaDiKGJx8pS5xB4IHaZ20h7jeYmAZyE.jpg"" alt=""Stop Net Neutrality because reasons and stuff."" title=""Stop Net Neutrality because reasons and stuff."" /></a> </td><td> submitted by <a href=""http://www.reddit.com/user/addicuss""> addicuss </a> <br/> <a href=""http://imgur.com/gallery/k8fN1y8/new"">[link]</a> <a href=""http://www.reddit.com/r/netneutrality/comments/2xcsbg/stop_net_neutrality_because_reasons_and_stuff/"">[comment]</a> </td></tr></table>",http://www.reddit.com/r/netneutrality/comments/2xcsbg/stop_net_neutrality_because_reasons_and_stuff/
"Fri, 27 Feb 2015 06:12:53 -0800",Question about throttling and data plans,"<!-- SC_OFF --><div class=""md""><p>We just heard that there can be no throttling, but my smartphone carrier allows me 3GB of data at high speed and the rest of the fiscal month is at a lower speed. Do these new regulations governing throttling impact that any?</p> </div><!-- SC_ON --> submitted by <a href=""http://www.reddit.com/user/Aearion30""> Aearion30 </a> <br/> <a href=""http://www.reddit.com/r/netneutrality/comments/2xcox5/question_about_throttling_and_data_plans/"">[link]</a> <a href=""http://www.reddit.com/r/netneutrality/comments/2xcox5/question_about_throttling_and_data_plans/"">[2 comments]</a>",http://www.reddit.com/r/netneutrality/comments/2xcox5/question_about_throttling_and_data_plans/
