Date,Title,Description,Link
"Thu, 12 Feb 2015 06:16:11 -0800",Tell Congress to stand for strong #NetNeutrality,"<table> <tr><td> <a href=""http://www.reddit.com/r/netneutrality/comments/2vni9q/tell_congress_to_stand_for_strong_netneutrality/""><img src=""http://b.thumbs.redditmedia.com/uZ9cMS8XO2hKdKgQyc3W46DHG3pEoXBsV5AIotdA35w.jpg"" alt=""Tell Congress to stand for strong #NetNeutrality"" title=""Tell Congress to stand for strong #NetNeutrality"" /></a> </td><td> submitted by <a href=""http://www.reddit.com/user/bobk1""> bobk1 </a> <br/> <a href=""http://act.demandprogress.org/sign/ThuneUpton?referring_akid=.2196808.9ur8fp&amp;source=reddit"">[link]</a> <a href=""http://www.reddit.com/r/netneutrality/comments/2vni9q/tell_congress_to_stand_for_strong_netneutrality/"">[comment]</a> </td></tr></table>",http://www.reddit.com/r/netneutrality/comments/2vni9q/tell_congress_to_stand_for_strong_netneutrality/
"Wed, 11 Feb 2015 11:43:37 -0800","Business Line: conti in Svizzera, mutui in franchi e neutralità della Rete | euronews, Business Line","<table> <tr><td> <a href=""http://www.reddit.com/r/netneutrality/comments/2vkhjj/business_line_conti_in_svizzera_mutui_in_franchi/""><img src=""http://b.thumbs.redditmedia.com/Ny5qdTxZGlmmNdxXJwg0-8zkQamlqlh4epkMdy-NNOY.jpg"" alt=""Business Line: conti in Svizzera, mutui in franchi e neutralità della Rete | euronews, Business Line"" title=""Business Line: conti in Svizzera, mutui in franchi e neutralità della Rete | euronews, Business Line"" /></a> </td><td> submitted by <a href=""http://www.reddit.com/user/Giacomo82""> Giacomo82 </a> <br/> <a href=""http://it.euronews.com/2015/02/11/business-line-conti-in-svizzera-mutui-in-franchi-e-neutralita-della-rete/#.VNuw4H_dhaU.reddit"">[link]</a> <a href=""http://www.reddit.com/r/netneutrality/comments/2vkhjj/business_line_conti_in_svizzera_mutui_in_franchi/"">[1 comment]</a> </td></tr></table>",http://www.reddit.com/r/netneutrality/comments/2vkhjj/business_line_conti_in_svizzera_mutui_in_franchi/
"Tue, 10 Feb 2015 15:38:25 -0800",Utah Senator Mike Lee Tried To Convince Me To Vote Against Net Neutrality,"<!-- SC_OFF --><div class=""md""><p>This morning (Australian Eastern Standard Time) I received an email from Senator Mike Lee urging me to sign a petition against classifying the internet under Title II.<br/> Here&#39;s the thing, the petition - <a href=""http://start.protectinternetfreedom.com/support/?utm_source=TH&amp;utm_medium=email&amp;utm_term=TH&amp;utm_content=v1&amp;utm_campaign=lee-test&amp;signer=ML&amp;theme=0"">http://start.protectinternetfreedom.com/support/?utm_source=TH&amp;utm_medium=email&amp;utm_term=TH&amp;utm_content=v1&amp;utm_campaign=lee-test&amp;signer=ML&amp;theme=0</a> - is called &quot;Protect Internet Freedom&quot; and Mr. Lee genuinely believes that he&#39;s doing that by allowing internet companies to set speed limits on individual websites.<br/> He attacks the supposed new fees that Title II will bring upon internet service providers, despite the fact that Obama&#39;s initial proposal advised the FCC against doing that. He also believes that government regulation will silence free speech despite the fact that the entire point of Net Neutrality laws is to stop telecom companies doing exactly that. Furthermore, he sent the email through Townhall.com - a right wing news organization that I unsubscribed from a month ago. I find it grossly inappropriate to use what should be an independent news website&#39;s mailing list to send out lies pushing your own political agenda.<br/> The full text of the email is written below and I urge all of you to pick apart its fallacies and email the senator here: <a href=""http://www.lee.senate.gov/public/index.cfm/contact"">http://www.lee.senate.gov/public/index.cfm/contact</a> </p> <p>TL;DR Senator Mike Lee is spreading ignorant lies about Net Neutrality and I want to help reverse that. Let him know how wrong he is, and just how many people are aware of his ignorance. </p> <p>&quot;Dear Friends,</p> <p>Obamacare, the VA scandal, the IRS scandal--these are just a few examples of what happens when we give government huge power without oversight. </p> <p>It&#39;s about to happen again--the Obama Administration is fighting for a government takeover of the Internet and the Federal Communications Commission is going to vote on it February 26th. That&#39;s why I am writing you today--I need your help to stop this.</p> <p>President Obama came out a few weeks ago urging the FCC to vote to regulate the Internet the same way that it regulates public utilities under Title II. What this means is that, for the first time, billions of dollars in fees will be attached to Internet service just like they are to telephone service. </p> <p>You see, under Title II if someone wants to own a telephone company, there are fees baked into the law--fees companies pass on to customers. </p> <p>Now, under this new regulatory regime, Internet service providers will be subject to these fees as well, and then pass them on to you, the consumer. </p> <p>This is essentially a massive tax increase on the middle class, being passed in the dead of night without the American public really being made aware of what is going on. </p> <p>The Internet is built on speed and dynamism, it’s always changing, there are always new and better ideas that are exploding onto the scene, and part of the reason for that is that innovators are not having to go ask Washington, DC for permission every time they want to do something new. </p> <p>What this really comes down to is a fundamental question:</p> <p>Who do you want in charge of the direction of the Internet: people at dot-com startups that brought us game changing companies like Facebook, Google, Twitter, Amazon and Uber; or nameless, faceless, unelected bureaucrats in our nation’s capital?</p> <p>There is another aspect of this that gets overlooked: the Internet is an incredibly important force for freedom, for liberty, and the rights of free speech that we hold dear. It is an existential threat to tyrants in countries like Iran, Saudi Arabia, and Russia who seek to keep information from their people. </p> <p>We must preserve the high ground for the United States to stand up to these countries and tell them to keep the Internet free and preserve free speech on the Internet throughout the world. We cannot do that if we are regulating the Internet in a similar manner ourselves. </p> <p>I am not accusing anyone of sinister motives here, but I am deeply concerned about the idea of any government bureaucrat having the power to tell companies what they can and cannot do. In the long term, this could have a chilling effect on political speech, in ways that today we could not even begin to imagine. </p> <p>We do not have much time left to stop this gigantic government takeover of the Internet. The FCC is voting on February 26th and the Left is mobilizing to support their effort to do so. We cannot let the conversation be totally one-sided. The FCC needs to hear from us today--not tomorrow or next week or next month. Today.</p> <p>Please join me and go sign the petition to keep the Internet free. We must stand for liberty and preserve the Internet free of government interference. </p> <p>Thank you for standing for Internet freedom. </p> <p>Sincerely,</p> <p>Senator Mike Lee Republican-Utah&quot;</p> </div><!-- SC_ON --> submitted by <a href=""http://www.reddit.com/user/productofmycreation""> productofmycreation </a> <br/> <a href=""http://www.reddit.com/r/netneutrality/comments/2vh3h7/utah_senator_mike_lee_tried_to_convince_me_to/"">[link]</a> <a href=""http://www.reddit.com/r/netneutrality/comments/2vh3h7/utah_senator_mike_lee_tried_to_convince_me_to/"">[4 comments]</a>",http://www.reddit.com/r/netneutrality/comments/2vh3h7/utah_senator_mike_lee_tried_to_convince_me_to/
"Tue, 10 Feb 2015 10:02:08 -0800","8 pages of regulations, not 332. Stop Republican lies.","<table> <tr><td> <a href=""http://www.reddit.com/r/netneutrality/comments/2vftvn/8_pages_of_regulations_not_332_stop_republican/""><img src=""http://b.thumbs.redditmedia.com/GjVUuZYHE_Zg95zDMtCmmE3DyqONWuhIeLRYNr2jWjc.jpg"" alt=""8 pages of regulations, not 332. Stop Republican lies."" title=""8 pages of regulations, not 332. Stop Republican lies."" /></a> </td><td> submitted by <a href=""http://www.reddit.com/user/djs758""> djs758 </a> <br/> <a href=""http://recode.net/2015/02/10/republican-complaints-about-fcc-net-neutrality-plan-grow/"">[link]</a> <a href=""http://www.reddit.com/r/netneutrality/comments/2vftvn/8_pages_of_regulations_not_332_stop_republican/"">[3 comments]</a> </td></tr></table>",http://www.reddit.com/r/netneutrality/comments/2vftvn/8_pages_of_regulations_not_332_stop_republican/
"Tue, 10 Feb 2015 00:04:40 -0800",Everybody on the Internet,"submitted by <a href=""http://www.reddit.com/user/planet-unicorn""> planet-unicorn </a> <br/> <a href=""https://www.tumblr.com/everybodyontheinternet"">[link]</a> <a href=""http://www.reddit.com/r/netneutrality/comments/2vecz1/everybody_on_the_internet/"">[comment]</a>",http://www.reddit.com/r/netneutrality/comments/2vecz1/everybody_on_the_internet/
"Mon, 09 Feb 2015 16:30:08 -0800",I received a response on data usage from the FCC!,"<!-- SC_OFF --><div class=""md""><p>Thought I would share this. I received a response from the FCC in regards to data usage caps. They have pointed me to something I think everyone should be aware of and fill out if you have concerns about it. Feel free to x-post this into other relevant subs, or whatever it is you have to do!</p> <hr/> <p>Thank you for filing a complaint with the FCC regarding data caps applied to your broadband Internet service. The FCC recognizes the potential significance of data caps and other usage-based pricing for consumers of both fixed and mobile broadband services, and has been evaluating developments on this issue in several ongoing proceedings. In particular, the FCC asked for comment on a variety of usage-based pricing and transparency issues in conjunction with its proceeding to promote and protect an Open Internet.</p> <p>You might want to add public comments to this proceeding’s record. If so, you can search for this proceeding (Docket No. 14-28) and submit your comments through this portal: <a href=""http://apps.fcc.gov/ecfs"">http://apps.fcc.gov/ecfs</a>.</p> <hr/> <p><strong><em>the comment I left on the docket is as follows. IF anyone needs help filling it out, please let me know. Its a bit clunky, but not too difficult.</em></strong></p> <hr/> <p>There has been evidence of decent improvement in an Open internet in recent weeks, and I would love to see this progress more.</p> <p>A subject that has not been touched on (at least significantly) is usage caps. The reality is this: the internet grows, high def content is on the rise. Youtube, netflix, hulu, and live streaming services such as twitch.tv are a huge deal.</p> <p>Work from home has never been more popular as well. usage caps limit all these things to great effect and stifle the progress of an open internet. With recent news, it is my fear that large ISP&#39;s will try to take advantage of this by having stricter mandates on their current usage caps. I fear if they cannot have a lane-based internet, they will try to punish those that use more data. I do not think ISP&#39;s being classified as utility will scare them from this due to competition, ESPECIALLY if most ISP&#39;s agree behind closed doors to all do this.</p> <p>As of right now, this is hurting me. I don&#39;t want it to get worse. I exceed my usage cap and pay an absurd fee for it. the only two options I have let me either:</p> <p>A.) increase my monthly usage cap (I can buy x gb for x USD)</p> <p>B.) Get business class internet.</p> <p>In option A, it works but only to a certain point. I have reached that point. There is a treshhold where option A is no cheaper than just paying the overages without going with this option to begin with.</p> <p>Option B is EXTREMELY expensive. We are talking $300+ dollars per month for the package i have now (which is about 90$ minus the cap overages). What I am paying in overages doesn&#39;t even begin to come close to entertaining option B as a viable option.</p> <p>ISP&#39;s claim data usage is there because their network capacity simply cannot handle the load. However, to sell the usage cap idea, they usually claim in the same paragraphs that only a very very small precentage of their consumer base ever reach those data usage caps and go on to show a chart on what precentage of their average cap usages for each package is.</p> <p>This, to me, does not make sense. I think to most people that take the time to look at things such as &quot;internet allowence&quot; policies they will quickly realize its a money grab, and not a very well thought out one.</p> <p>There has been plenty news of several ISP&#39;s reaching 70, 80, and even 90% net profit. They have the money to support and expand their infrastructure if needed, and there has been plenty evidence ISP&#39;s haven&#39;t even begin to reach capcity of their current infrastructure.</p> <p>In summary, data usage caps I believe will be used by ISP&#39;s as a backup plan to &quot;fast lane internet&quot;. it is also a current thing that is being used now that hurts many users in being able to either work from home, or entertainment. We are not being charged per gigabyte overage of high-def cable tv content, and should not be charged like this for internet-focused content. It is absurd, greedy, and stifles economic growth.</p> <p>Thank you for your time.</p> <hr/> </div><!-- SC_ON --> submitted by <a href=""http://www.reddit.com/user/distortednet""> distortednet </a> <br/> <a href=""http://www.reddit.com/r/netneutrality/comments/2vd1m9/i_received_a_response_on_data_usage_from_the_fcc/"">[link]</a> <a href=""http://www.reddit.com/r/netneutrality/comments/2vd1m9/i_received_a_response_on_data_usage_from_the_fcc/"">[comment]</a>",http://www.reddit.com/r/netneutrality/comments/2vd1m9/i_received_a_response_on_data_usage_from_the_fcc/
"Mon, 09 Feb 2015 13:10:31 -0800",I got an (accidental) view of what a closed Internet could look like today and I thought I'd capture it on a video and share,"<table> <tr><td> <a href=""http://www.reddit.com/r/netneutrality/comments/2vcauj/i_got_an_accidental_view_of_what_a_closed/""><img src=""http://b.thumbs.redditmedia.com/G7MF_tym1KD1Qtfv6DvB2o2BVoVrhFaowB66TpssqNE.jpg"" alt=""I got an (accidental) view of what a closed Internet could look like today and I thought I'd capture it on a video and share"" title=""I got an (accidental) view of what a closed Internet could look like today and I thought I'd capture it on a video and share"" /></a> </td><td> submitted by <a href=""http://www.reddit.com/user/AnonYmous828282""> AnonYmous828282 </a> <br/> <a href=""https://www.youtube.com/watch?v=swY28Tw4I50"">[link]</a> <a href=""http://www.reddit.com/r/netneutrality/comments/2vcauj/i_got_an_accidental_view_of_what_a_closed/"">[comment]</a> </td></tr></table>",http://www.reddit.com/r/netneutrality/comments/2vcauj/i_got_an_accidental_view_of_what_a_closed/
"Mon, 09 Feb 2015 08:00:45 -0800",Nebraska senator on net neutrality on the Glenn Beck Program. Did anyone else hear this?,"<!-- SC_OFF --><div class=""md""><p>The senator says net neutrality is a bad idea. Did anyone else hear this? Thoughts?</p> </div><!-- SC_ON --> submitted by <a href=""http://www.reddit.com/user/jhenz616""> jhenz616 </a> <br/> <a href=""http://www.reddit.com/r/netneutrality/comments/2vb5g6/nebraska_senator_on_net_neutrality_on_the_glenn/"">[link]</a> <a href=""http://www.reddit.com/r/netneutrality/comments/2vb5g6/nebraska_senator_on_net_neutrality_on_the_glenn/"">[comment]</a>",http://www.reddit.com/r/netneutrality/comments/2vb5g6/nebraska_senator_on_net_neutrality_on_the_glenn/
"Mon, 09 Feb 2015 03:58:00 -0800",Lawmakers like Fred Upton are FCC hypocrites,"<table> <tr><td> <a href=""http://www.reddit.com/r/netneutrality/comments/2vaj4i/lawmakers_like_fred_upton_are_fcc_hypocrites/""><img src=""http://b.thumbs.redditmedia.com/cnFa7bd68SBfUy9UVQpvKGSKfnJ7W7FKjtOSUoDJEEw.jpg"" alt=""Lawmakers like Fred Upton are FCC hypocrites"" title=""Lawmakers like Fred Upton are FCC hypocrites"" /></a> </td><td> submitted by <a href=""http://www.reddit.com/user/TaxDawg""> TaxDawg </a> <br/> <a href=""http://www.androidauthority.com/lawmakers-like-fred-upton-fcc-hypocrites-585562/"">[link]</a> <a href=""http://www.reddit.com/r/netneutrality/comments/2vaj4i/lawmakers_like_fred_upton_are_fcc_hypocrites/"">[comment]</a> </td></tr></table>",http://www.reddit.com/r/netneutrality/comments/2vaj4i/lawmakers_like_fred_upton_are_fcc_hypocrites/
"Sat, 07 Feb 2015 16:33:35 -0800",Department of the Internet: Installation,"<table> <tr><td> <a href=""http://www.reddit.com/r/netneutrality/comments/2v57je/department_of_the_internet_installation/""><img src=""http://b.thumbs.redditmedia.com/cNf1rSQ7FuaCpwDK5_PSv5YpDVSv8kANSojaoMUF6mw.jpg"" alt=""Department of the Internet: Installation"" title=""Department of the Internet: Installation"" /></a> </td><td> submitted by <a href=""http://www.reddit.com/user/RAndrewOhge""> RAndrewOhge </a> <br/> <a href=""http://www.youtube.com/attribution_link?a=Pr0Iq-Mp6qY&amp;u=%2Fwatch%3Fv%3DVcYyK6MhIfM%26feature%3Dshare"">[link]</a> <a href=""http://www.reddit.com/r/netneutrality/comments/2v57je/department_of_the_internet_installation/"">[5 comments]</a> </td></tr></table>",http://www.reddit.com/r/netneutrality/comments/2v57je/department_of_the_internet_installation/
"Sat, 07 Feb 2015 15:36:29 -0800",Nebraska Senator spreading petition to end net neutrality. Sign the petition: Ben Sasse: End the War on Net Neutrality,"<table> <tr><td> <a href=""http://www.reddit.com/r/netneutrality/comments/2v5194/nebraska_senator_spreading_petition_to_end_net/""><img src=""http://b.thumbs.redditmedia.com/xhpdty3FD5sj8CIKt1xILT1GwjB6nNeduILO4zkY_Sc.jpg"" alt=""Nebraska Senator spreading petition to end net neutrality. Sign the petition: Ben Sasse: End the War on Net Neutrality"" title=""Nebraska Senator spreading petition to end net neutrality. Sign the petition: Ben Sasse: End the War on Net Neutrality"" /></a> </td><td> submitted by <a href=""http://www.reddit.com/user/gawdchalk""> gawdchalk </a> <br/> <a href=""http://petitions.moveon.org/sign/ben-sasse-end-the-war?source=c.em&amp;r_by=11377916"">[link]</a> <a href=""http://www.reddit.com/r/netneutrality/comments/2v5194/nebraska_senator_spreading_petition_to_end_net/"">[3 comments]</a> </td></tr></table>",http://www.reddit.com/r/netneutrality/comments/2v5194/nebraska_senator_spreading_petition_to_end_net/
"Sat, 07 Feb 2015 09:31:17 -0800","fake website, fake organization to ""Protect internet freedom""","<!-- SC_OFF --><div class=""md""><p>Pardon, I don&#39;t submit much... </p> <p>I ran across this: <a href=""http://www.protectinternetfreedom.com/"">http://www.protectinternetfreedom.com/</a></p> <p>Which seems to be a complete distortion of truth. I notice they don&#39;t let people write anything on the website.... </p> <p>They pretend to be for internet freedom, but their definition seems to be the usual right wing &quot;Government Bad!&quot; spiel. </p> <p>I notice they&#39;re taking money too... They even have an ad up that&#39;s completely full of !@#$. </p> <p><a href=""https://www.youtube.com/watch?v=VcYyK6MhIfM"">https://www.youtube.com/watch?v=VcYyK6MhIfM</a></p> <p>I notice comments are disable for that video too... </p> <p>Protect Internet Freedom, but don&#39;t let anyone comment on your website or video... Grrr... </p> <p>Anyway, do me a favor and email them and tell them they&#39;re full of it? </p> </div><!-- SC_ON --> submitted by <a href=""http://www.reddit.com/user/tonydiethelm""> tonydiethelm </a> <br/> <a href=""http://www.reddit.com/r/netneutrality/comments/2v3uad/fake_website_fake_organization_to_protect/"">[link]</a> <a href=""http://www.reddit.com/r/netneutrality/comments/2v3uad/fake_website_fake_organization_to_protect/"">[3 comments]</a>",http://www.reddit.com/r/netneutrality/comments/2v3uad/fake_website_fake_organization_to_protect/
"Fri, 06 Feb 2015 23:07:13 -0800",Viacom blocks online streaming over cable channel dispute.,"<table> <tr><td> <a href=""http://www.reddit.com/r/netneutrality/comments/2v2mf4/viacom_blocks_online_streaming_over_cable_channel/""><img src=""http://b.thumbs.redditmedia.com/fcs06ij8fYP7bLWK1z1C0aUwjvADEtwYgc0tpOZuc5A.jpg"" alt=""Viacom blocks online streaming over cable channel dispute."" title=""Viacom blocks online streaming over cable channel dispute."" /></a> </td><td> submitted by <a href=""http://www.reddit.com/user/indolering""> indolering </a> <br/> <a href=""http://imgur.com/a/NaXve"">[link]</a> <a href=""http://www.reddit.com/r/netneutrality/comments/2v2mf4/viacom_blocks_online_streaming_over_cable_channel/"">[5 comments]</a> </td></tr></table>",http://www.reddit.com/r/netneutrality/comments/2v2mf4/viacom_blocks_online_streaming_over_cable_channel/
"Fri, 06 Feb 2015 14:25:16 -0800",This is how to explain what Net Neutrality is all about in a way everyone can understand. :D,"<!-- SC_OFF --><div class=""md""><p>Imagine you had a lemonade stand where the lemonade is free for all to enjoy... Now imagine Comcast comes along and makes 64 billion a year by charging for cups which nobody else is able to provide because Comcast bought them all.</p> <p>Can Comcast and other service providers legally do that? Unfortunately they can because there are no rules to say they can&#39;t. Although it may not be illegal at present time, it is highly unethical. This is exactly what the FCC&#39;s Net Neutrality proposal would help prevent and will be voted on at the end of this month.</p> <p>The internet is free, IT IS NOT FOR RESALE! Groups like Comcast have no right to charge excessive fees for, or limit access to, something which is already free to use and is a publicly shared resource. Reasonable service charges is one thing, monopolizing an entire market just to drive up prices and limiting access is totally a different story and shouldn&#39;t be permitted at all.</p> <p>This is what Net Neutrality is all about.</p> <h1>TeamInternet</h1> <h1>NetNeutrality</h1> </div><!-- SC_ON --> submitted by <a href=""http://www.reddit.com/user/RF2OOO""> RF2OOO </a> <br/> <a href=""http://www.reddit.com/r/netneutrality/comments/2v16aw/this_is_how_to_explain_what_net_neutrality_is_all/"">[link]</a> <a href=""http://www.reddit.com/r/netneutrality/comments/2v16aw/this_is_how_to_explain_what_net_neutrality_is_all/"">[5 comments]</a>",http://www.reddit.com/r/netneutrality/comments/2v16aw/this_is_how_to_explain_what_net_neutrality_is_all/
"Fri, 06 Feb 2015 05:31:30 -0800",DO they think we are that stupid? Title II hurts their bottom line that's all. #WirelessIsDifferent,"<table> <tr><td> <a href=""http://www.reddit.com/r/netneutrality/comments/2uzd44/do_they_think_we_are_that_stupid_title_ii_hurts/""><img src=""http://b.thumbs.redditmedia.com/F3ZM8sy4MowvIVscvqxiepPf25vg1bwRYezqVrG7-gY.jpg"" alt=""DO they think we are that stupid? Title II hurts their bottom line that's all. #WirelessIsDifferent"" title=""DO they think we are that stupid? Title II hurts their bottom line that's all. #WirelessIsDifferent"" /></a> </td><td> submitted by <a href=""http://www.reddit.com/user/re8609""> re8609 </a> <br/> <a href=""http://www.youtube.com/attribution_link?a=T0pVCRaT8KI&amp;u=%2Fwatch%3Fv%3Ds2lTxLH_tsc%26feature%3Dshare"">[link]</a> <a href=""http://www.reddit.com/r/netneutrality/comments/2uzd44/do_they_think_we_are_that_stupid_title_ii_hurts/"">[2 comments]</a> </td></tr></table>",http://www.reddit.com/r/netneutrality/comments/2uzd44/do_they_think_we_are_that_stupid_title_ii_hurts/
"Thu, 05 Feb 2015 14:55:53 -0800",Republicans Aim to Block the FCC's Net Neutrality Plan,"submitted by <a href=""http://www.reddit.com/user/pateras""> pateras </a> <br/> <a href=""http://www.bloomberg.com/politics/articles/2015-02-04/republicans-aim-to-block-the-fcc-s-net-neutrality-plan"">[link]</a> <a href=""http://www.reddit.com/r/netneutrality/comments/2ux80g/republicans_aim_to_block_the_fccs_net_neutrality/"">[2 comments]</a>",http://www.reddit.com/r/netneutrality/comments/2ux80g/republicans_aim_to_block_the_fccs_net_neutrality/
"Thu, 05 Feb 2015 10:05:39 -0800",Public Knowledge telecom lawyers doing an AMA on net neutrality and Title II starting NOW!,"submitted by <a href=""http://www.reddit.com/user/ozoxy""> ozoxy </a> <br/> <a href=""http://www.reddit.com/r/IAmA/comments/2uw4z7/its_net_neutrality_fun_time_we_are_public/"">[link]</a> <a href=""http://www.reddit.com/r/netneutrality/comments/2uw6hd/public_knowledge_telecom_lawyers_doing_an_ama_on/"">[comment]</a>",http://www.reddit.com/r/netneutrality/comments/2uw6hd/public_knowledge_telecom_lawyers_doing_an_ama_on/
"Thu, 05 Feb 2015 07:32:46 -0800",Can this be refuted at all? 'New FCC rules will kick at least 4.7 million households offline',"<table> <tr><td> <a href=""http://www.reddit.com/r/netneutrality/comments/2uvn0r/can_this_be_refuted_at_all_new_fcc_rules_will/""><img src=""http://a.thumbs.redditmedia.com/vPy8OPlUyRpXQrfcHBDPPZ7cFUKEPGVwxSQ-yBJNNn0.jpg"" alt=""Can this be refuted at all? 'New FCC rules will kick at least 4.7 million households offline'"" title=""Can this be refuted at all? 'New FCC rules will kick at least 4.7 million households offline'"" /></a> </td><td> submitted by <a href=""http://www.reddit.com/user/tinlo""> tinlo </a> <br/> <a href=""https://medium.com/tech-liberation/new-fcc-rules-will-kick-at-least-6-million-households-offline-58eeba0b3b71"">[link]</a> <a href=""http://www.reddit.com/r/netneutrality/comments/2uvn0r/can_this_be_refuted_at_all_new_fcc_rules_will/"">[13 comments]</a> </td></tr></table>",http://www.reddit.com/r/netneutrality/comments/2uvn0r/can_this_be_refuted_at_all_new_fcc_rules_will/
